index,ItemDescription
PINK EASTER HENS+FLOWER,18
PINK ROSEBUD & PEARL NECKLACE,18
CRYSTAL CZECH CROSS PHONE CHARM,18
TUSCAN VILLA BIRD FEEDER,18
GOLD DIAMANTE STAR BROOCH,18
AMBER CHUNKY BEAD BRACELET W STRAP,18
ENVELOPE 50 ROMANTIC IMAGES,18
GIFT BAG LARGE VINTAGE CHRISTMAS,18
SET 4 PICNIC CUTLERY CHERRY ,18
BLUE EASTER EGG HUNT START POST,18
YELLOW POT PLANT CANDLE,18
PINK HEART OF GLASS BRACELET,18
CREAM HANGING HEART T-LIGHT HOLDER,18
PINK GLASS CHUNKY CHARM BRACELET,18
FILIGREE DIAMANTE EARRINGS,18
PINK STRING CURTAIN WITH POLE,18
"Unsaleable, destroyed.",18
IVORY SHELL HEART EARRINGS,18
CD WALL TIDY RED FLOWERS,16
GREEN/BLUE FLOWER DESIGN BIG MUG,16
DIAMOND LAS VEGAS NECKLACE 45CM,16
SILVER APERITIF GLASS,16
SET 10 CARDS SCOTTIE DOG 17211,16
TURQ PENDANT TRIPLE SHELL NECKLACE,16
ASSORTED CAKES FRIDGE MAGNETS,16
SET OF 3 CONEY ISLAND OVAL BOXES,16
AMBER 3 BEAD DROP EARRINGS,16
PINK/YELLOW FLOWERS HANDBAG,16
RED POLKADOT PUDDING BOWL,16
MODERN VINTAGE COTTON SHOPPING BAG,16
FROG SOCK PUPPET,16
CAKE SHOP  STICKER SHEET,16
ZINC HEART LATTICE CHARGER SMALL,16
YELLOW DRAGONFLY HELICOPTER,16
amazon,16
SET/9 CHRISTMAS T-LIGHTS SCENTED ,16
BLACK GRAND BAROQUE PHOTO FRAME,16
"LETTER ""Y"" BLING KEY RING",16
VINTAGE ZINC WATERING CAN,16
BEACH HUT MIRROR,16
GREEN MURANO TWIST NECKLACE,16
GREEN DROP EARRINGS W BEAD CLUSTER,16
DOLLCRAFT GIRL AMELIE,16
DOLLCRAFT GIRL AMELIE KIT,16
AMBER CHUNKY GLASS+BEAD NECKLACE,16
CREAM DELPHINIUM ARTIFICIAL FLOWER,16
RECIPE BOX WITH METAL HEART,16
RASPBERRY ANT COPPER FLOWER NECKLAC,16
LILY BROOCH AMETHYST COLOUR,16
GARDEN PATH NOTEBOOK ,16
SQUARE METAL CANDLEHOLDER BASE,16
BLUE POLKADOT PUDDING BOWL,16
CD WALL TIDY BLUE OFFICE,16
IVORY SHELL HEART NECKLACE,16
T-LIGHT HOLDER SILVER SAUCER,16
THE KING GIFT BAG,16
WHITE VINT ART DECO CRYSTAL NECKLAC,16
TURQ ICE CREAM BUM BAG ,16
BOTANICAL LILY GIFT WRAP,16
PAINTED SEA SHELL METAL WINDCHIME,16
Dotcomgiftshop Gift Voucher 10.00,16
PINK HEARTS PAPER GARLAND,16
BLUE SQUARE COMPACT MIRROR,16
CRYSTAL STUD EARRINGS CLEAR DISPLAY,16
SILVER LATTICE VANILLA CANDLE POT,16
VINTAGE ZINC WATERING CAN SMALL,16
THE KING GIFT BAG 25x24x12cm,16
PURPLE ACRYLIC FACETED BANGLE,16
WRAP FOLK ART,16
LOVE POTION MASALA INCENSE,16
BLACK VINTAGE  CRYSTAL EARRINGS,16
ORIGAMI VANILLA INCENSE CONES,16
ELVIS WALLHANGING / CURTAIN,16
MOROCCAN BEATEN METAL DISH LARGE,16
FRENCH CHATEAU SMALL FRUITBOWL,16
KIDS CUTLERY SPACEBOY ,16
FLAMES SUNGLASSES PINK LENSES,16
JET BLACK LAS VEGAS BRACELET ROUND,16
"LARGE CAKE TOWEL, CHOCOLATE SPOTS",16
Found,16
5 STRAND GLASS NECKLACE AMETHYST,16
GOLDIE LOOKING MIRROR,16
KIDS CUTLERY DOLLY GIRL ,16
ANTIQUE GLASS PLACE SETTING,16
DROP EARRINGS W FLOWER & LEAF,16
SMALL ZINC/GLASS CANDLEHOLDER,16
GLASS AND PAINTED BEADS BRACELET OL,16
WAY OUT METAL SIGN ,16
SILICON STAR BULB  BLUE,16
SET 8 CANDLES VINTAGE DOILEY,14
TURQUOISE BERTIE GLASS BEAD CHARM,14
"TUMBLER, BAROQUE",14
HOLLY TOP CHRISTMAS STOCKING,14
ZINC HEART LATTICE TRAY OVAL ,14
CROCHET WHITE RABBIT KEYRING ,14
Dotcomgiftshop Gift Voucher 30.00,14
RESIN NECKLACE W PASTEL BEADS,14
REGENCY MIRROR WITH SHUTTERS,14
JET BLACK LAS VEGAS NECKLACE 45CM,14
CLEAR ACRYLIC FACETED BANGLE,14
ANT SILVER FUSCHIA BOUDICCA RING,14
NEW BAROQUE B'FLY NECKLACE RED,14
"BUNTING , SPOTTY ",14
MIDNIGHT BLUE COPPER FLOWER NECKLAC,14
SWEETHEART CARRY-ALL BASKET,14
15 PINK FLUFFY CHICKS IN BOX,14
GEMSTONE CHANDELIER T-LIGHT HOLDER,14
IVORY SCULPTED RND CANDLE ,14
JUMBO BAG VINTAGE DOILEY ,14
AMBER GLASS/SHELL/PEARL NECKLACE,14
GOLD SCROLL GLASS T-LIGHT HOLDER,14
MOROCCAN BEATEN METAL DISH,14
GOLD/AMBER DROP EARRINGS W LEAF,14
SILVER/M.O.P PENDANT ORBIT NECKLACE,14
FLAG OF ST GEORGE ,14
PINK B'FLY C/COVER W BOBBLES,14
SET 10 CARDS HATS & STOCKINGS 17081,14
BLUE NETTING STORAGE HANGER,14
ASS COL LARGE SAND FROG P'WEIGHT,14
SET 10 CARDS WISHING TREE 17116,14
TRANQUILITY MASALA INCENSE,14
BLACK FEATHER CHRISTMAS DECORATION,14
BLUE HOLE PUNCH,14
AMBER GLASS TASSLE BAG CHARM,14
CRACKED GLAZE NECKLACE RED,14
ROMANTIC IMAGES SCRAP BOOK SET,14
BLUE WIRE SPIRAL CANDLE HOLDER,14
ASS COL CIRCLE MOBILE ,14
FINE SILVER NECKLACE W PASTEL FLOWE,14
"STRING OF 8 BUTTERFLIES,PINK",14
YULETIDE IMAGES S/6 PAPER BOXES,14
SET 10 CARDS PERFECT POST 17090,14
??,14
Amazon,14
BLACK CRYSTAL DROP EARRINGS,14
TUSCAN VILLA FEEDING STATION,14
SET 10 CARDS JINGLE BELLS 17217,14
ORIGAMI SANDLEWOOD INCENSE+FLOWER,14
PINK VINTAGE VICTORIAN EARRINGS,14
WHITE/PINK MINI CRYSTALS NECKLACE,14
BILI NUT AND WOOD NECKLACE,14
BUTTONS AND STRIPES NOTEBOOK ,14
"ACRYLIC HANGING JEWEL,PINK",14
SPOTTED WHITE NATURAL SEED NECKLACE,14
DROP DIAMANTE EARRINGS BLACK DIAMON,14
BLACK/WHITE GLASS/SILVER BRACELET,14
BIRD BOX CHRISTMAS TREE DECORATION,14
PINK/PURPLE CIRCLE CURTAIN,14
BLUE FLOWER DES PURSE,12
BLUE CHECK BAG W HANDLE 34X20CM,12
BLACK VINT ART DEC CRYSTAL NECKLACE,12
RED DAISY PAPER LAMPSHADE,12
RASTA IN BATH W SPLIFF ASHTRAY,12
PINK RIVIERA HANDBAG,12
MIDNIGHT BLUE CRYSTAL DROP EARRINGS,12
5 STRAND GLASS NECKLACE AMBER,12
DIAMANTE BOW BROOCH BLACK COLOUR,12
CHERRY BLOSSOM CANVAS ART PICTURE,12
SMALL JEWELLERY STAND,12
SET 10 XMAS CARDS & BADGES 17070,12
dotcom,12
SMALL SINGLE FLAME CANDLE HOLDER,12
GREEN HEART OF GLASS BRACELET,12
PINK BUTTERFLY WASHBAG,12
ALUMINIUM HEART,12
FIRE POLISHED GLASS BRACELET MONTAN,12
BLUE DELPHINIUM ARTIFICIAL FLOWER,12
ASSORTED SANSKRIT MINI NOTEBOOK,12
GIFT BAG LARGE SPOT ,12
CANDY SPOT BUNNY,12
BLUE GLASS CHUNKY CHARM BRACELET,12
FIRE POLISHED GLASS NECKL GREEN,12
DECROTIVEVINTAGE COFFEE GRINDER BOX,12
WISE MAN STAR SHAPE EGG PAN,12
GLASS BEAD HOOP EARRINGS AMETHYST,12
PINK BUTTERFLY CUSHION COVER,12
BLACK FINE BEAD NECKLACE W TASSEL,12
5 STRAND GLASS NECKLACE BLACK,12
FIRE POLISHED GLASS BRACELET BLACK,12
UTILTY CABINET WITH HOOKS,12
SILVER M.O.P. ORBIT NECKLACE,12
RAIN PONCHO ,12
3 PINK HEN+CHICKS IN BASKET,12
CLEAR MILKSHAKE GLASS,12
LILAC GAUZE BUTTERFLY LAMPSHADE,12
RUSTIC STRAWBERRY JAMPOT LARGE ,12
WHITE STONE/CRYSTAL EARRINGS,12
HAND OPEN SHAPE DECO.WHITE,12
PINK CLEAR GLASS CANDLE PLATE,12
PINK SPOTS CHOCOLATE NESTING BOXES ,12
SET 4 PICNIC CUTLERY FONDANT,12
POLYESTER FILLER PAD 65CMx65CM,12
FRENCH CHATEAU OVAL PLATTER,12
DECORATIVE HANGING SHELVING UNIT,12
WHITE VINTAGE CRYSTAL EARRINGS,12
PINK MURANO TWIST NECKLACE,12
PAPER LANTERN 6 POINT SNOW STAR,12
JADE CRYSTAL+GLASS BRACELET,12
DOORKNOB CRACKED GLAZE IVORY,12
SET 10 CARD CHRISTMAS WELCOME 17112,12
GREEN PEONY CUSHION COVER,12
SET OF 12 T-LIGHTS VINTAGE DOILEY,12
"DECORATION HEN ON NEST, HANGING",12
SPACE BOY CHILDRENS CUP,12
ANT SILVER PURPLE BOUDICCA RING,10
WHITE VINTAGE CRYSTAL BRACELET,10
TURQUOISE HEART OF GLASS BRACELET,10
BLUE TILED TRAY,10
SET 10 CARDS XMAS CHOIR 17068,10
PINK FLOWERS RABBIT EASTER,10
PURPLE AMETHYST NECKLACE W TASSEL,10
TINY CRYSTAL BRACELET GREEN,10
FUSCHIA TABLE RUN FLOWER ,10
HALL CABINET WITH 3 DRAWERS,10
ebay,10
PAPER LANTERN 5 POINT STAR MOON 30,10
"ACRYLIC JEWEL SNOWFLAKE, PINK",10
AMETHYST 3 BEAD DROP EARRINGS,10
DIAMANTE NECKLACE PURPLE,10
WHITE HEART OF GLASS BRACELET,10
HANGING RIDGE GLASS T-LIGHT HOLDER,10
BUNDLE OF 3 RETRO EXERCISE BOOKS,10
GLASS BEAD HOOP EARRINGS GREEN,10
"LETTER ""O"" BLING KEY RING",10
SET 10 CARDS CHRISTMAS TREE 16955,10
METAL HERB GERDEN CONTAINER,10
LUNCH BAG VINTAGE DOILEY ,10
PINK FLOCK GLASS CANDLEHOLDER,10
"FLOWER GLASS GARLAND NECKL.36""BLACK",10
MISELTOE HEART WREATH ,10
TINY CRYSTAL BRACELET BLUE,10
SET 10 CARDS JINGLE BELLS 16957,10
DOUBLE CERAMIC PARLOUR HOOK,10
WRAP SUMMER ROSE DESIGN,10
PURPLE GEMSTONE NECKLACE 45CM,10
"FLOWER GLASS GARLD NECKL36""TURQUOIS",10
CROCHET BEAR RED/BLUE  KEYRING,10
HEART TRELLISTRIPLE T-LIGHT HOLDER,10
TEATIME GEL PENS ASST,10
damages?,10
NEWSPAPER STAND,10
"FLOWER GLASS GARLAND NECKL.36""BLUE",10
FOLDING MIRROR HOT PINK ,10
WHITE MURANO TWIST BRACELET,10
BLACK GEMSTONE NECKLACE 45CM,10
RETRO BROWN BALL ASHTRAY ,10
wet damaged,10
PINK FOXGLOVE ARTIIFCIAL FLOWER,10
COTE D'AZURE NECKLACE,10
ROBIN CHRISTMAS CARD,10
PURPLE ENAMEL+GLASS HAIR COMB,10
CRACKED GLAZE NECKLACE IVORY,10
RED PEONY CUSHION COVER ,10
PINK/BLUE STRING CURTAIN ,10
CREAM SWEETHEART WALL CABINET,10
GOLD TEDDY BEAR,10
WHITE ROSEBUD & PEARL NECKLACE,10
IVORY PENDANT TRIPLE SHELL NECKLACE,10
BLUE HANGING GINGHAM EASTER HEN,10
FRESHWATER PEARL BRACELET IVORY,10
CREAM AND PINK FLOWERS PONY ,10
MURANO STYLE GLASS BRACELET RED,10
PAINT YOUR OWN EGGS IN CRATE,10
FLOWER FAIRY INCENSE BOUQUET,10
"LETTER ""W"" BLING KEY RING",10
CRACKED GLAZE EARRINGS BROWN,10
MIDNIGHT BLUE DROP CRYSTAL NECKLACE,10
PINK HYDRANGEA ART FLOWER,10
ANTIQUE OPAL WHITE FLOWER EARRINGS,10
SPOTS ON RED BOOKCOVER TAPE,10
PINK AND BLACK STRING CURTAIN,10
ANTIQUE OLIVE GREEN FLOWER EARRINGS,10
RIVIERA NECKLACE,10
BLUE WHITE PLASTIC RINGS LAMPSHADE,10
AMBER FINE BEAD NECKLACE W TASSEL,10
WHITE ALLIUM  ARTIFICIAL FLOWER,10
PINK DOG CANNISTER,10
"MUG , DOTCOMGIFTSHOP.COM ",10
LAZER CUT NECKLACE W PASTEL BEADS,10
had been put aside,10
PINK HANGING GINGHAM EASTER HEN,10
SILVER/NAT SHELL NECKLACE W PENDANT,10
MONTANA DIAMOND CLUSTER EARRINGS,10
FUSCHIA RETRO BAR STOOL,10
PAPER LANTERN 9 POINT HOLLY STAR 23,10
NEW BAROQUE B'FLY NECKLACE CRYSTAL,8
PURPLE FOXGLOVE ARTIIFCIAL FLOWER,8
PINK ROUND COMPACT MIRROR,8
VINTAGE ENAMEL & CRYSTAL NECKLACE,8
BAROQUE BUTTERFLY EARRINGS CRYSTAL,8
SET 10 CARD PERFECT NATIVITY 17089,8
CREAM CLIMBING HYDRANGA ART FLOWER,8
WHITE BEADED GARLAND STRING 20LIGHT,8
CHUNKY CRACKED GLAZE NECKLACE IVORY,8
VINTAGE ENGRAVED HEART,8
WINE BOTTLE DRESSING LT.BLUE,8
MISELTOE HEART WREATH WHITE,8
MULTICOLOUR EASTER RABBIT ,8
GLASS AND BEADS BRACELET IVORY,8
YELLOW/PINK CERAMIC CANDLE HOLDER,8
SILVER FLOWR PINK SHELL NECKLACE,8
"RUSTIC WOODEN CABINET, GLASS DOORS",8
PINK TALL PORCELAIN T-LIGHT HOLDER ,8
ARMY CAMO BOOKCOVER TAPE,8
A4 WALL TIDY RED FLOWERS,8
BLACK PHOTO ALBUM ,8
SILVER/NATURAL SHELL NECKLACE,8
BLUE PADDED SOFT MOBILE,8
"WRAP, CAROUSEL",8
"RETRO TIN ASHTRAY,REVOLUTIONARY",8
FLOWER PURPLE CLOCK WITH SUCKER,8
CUPID SCENTED CANDLE IN GLASS,8
PADS TO MATCH ALL CUSHIONS,8
DONKEY TAIL GAME ,8
SET 10 CARD SNOWMAN 16965,8
CRACKED GLAZE EARRINGS IVORY,8
3 TRADITIONAL COOKIE CUTTERS  SET,8
BLUE ORGANDY ROUND LAMPSHADE W BEA,8
MINI HIGHLIGHTER PENS,8
HANGING BUTTERFLY  EGG,8
PACK 20 DOLLY PEGS,8
CHERRY BLOSSOM TABLE CLOCK ,8
Dotcomgiftshop Gift Voucher 50.00,8
SET 10 CARDS SNOWY SNOWDROPS  17100,8
SET 10 CARDS PRINTED GRAPHIC 17219,8
BOXED GLASS ASHTRAY,8
PINK GAUZE BUTTERFLY LAMPSHADE,8
SET 10 CARDS MAGICAL TREE 17086,8
SET 10 CARDS DAVID'S MADONNA 17074,8
VINTAGE WOODEN BAR STOOL,8
FRENCH CHATEAU LARGE FRUIT BOWL ,8
NEW BAROQUE SMALL NECKLACE BLACK,8
BLACK GEMSTONE BRACELET,8
LARGE JEWELLERY STAND,8
ASSTD DESIGN BUBBLE GUM RING,8
smashed,8
PAPER LANTERN 5 POINT STUDDED STAR,8
GREEN METAL BOX TOP SECRET,8
SET 10 CARDS FILIGREE BAUBLE 16961,8
PEARL AND CHERRY QUARTZ BRACLET,8
TURQUOISE CHRISTMAS TREE ,8
MINITURE ANTIQUE ROSE HOOK IVORY,8
CAT AND BIRD WALL ART,8
HOME SWEEET HOME 3 PEG HANGER ,8
PINK FELT EASTER EGG BASKET,8
TUSCAN VILLA DOVECOTE,8
FLORAL BLUE MONSTER,8
ROUND CACTUS CANDLE,8
SPACEBOY MINI RUCKSACK,8
ORIENTAL RED CUSHION COVER ,8
ANTIQUE RASPBERRY FLOWER EARRINGS,8
MOP PENDANT SHELL NECKLACE,8
FLOWER GARLAND NECKLACE RED,8
SET 10 CHRISTMAS CARDS HOHOHO 16956,8
CLAM SHELL LARGE,8
DOG AND BALL WALL ART,8
ELEPHANT CLIP W SUCTION CUP,8
SET 6 CARDS SPARKLY REINDEER 17262,8
PINK BUNNY EASTER EGG BASKET,8
BLING KEY RING STAND,6
MULTICOLOUR POLKADOT PLATE,6
FOLDING CAMPING SCISSOR W/KNIF & S,6
LIGHTHOUSE PRINTED METAL SIGN,6
WALL ART BICYCLE SAFTEY ,6
wet pallet,6
SET 10 CARDS HANGING BAUBLES 17080,6
PINK CHRISTMAS FLOCK DROPLET ,6
BLUE CLIMBING HYDRANGA ART FLOWER,6
DIAMANTE NECKLACE BLACK ,6
missing,6
Adjust bad debt,6
PURPLE DRESS JEWELLERY STAND,6
FOLKART ZINC STAR CHRISTMAS DEC,6
Dotcomgiftshop Gift Voucher 40.00,6
CREAM BUNNY EASTER EGG BASKET,6
SET 10 CARDS WORLD CHILDREN 17067,6
UBO-LIGHT TRIOBASE PURPLE,6
VEGETABLE MAGNETIC  SHOPPING LIST,6
BLUE FLOCK CUSHION COVER ,6
SET 36 COLOUR PENCILS DOILEY,6
PINK SMALL GLASS CAKE STAND,6
HAND PAINTED HANGING EASTER EGG,6
SET 10 CARDS CHRISTMAS ROBIN 17095,6
FLOWERS HANDBAG blue and orange,6
SET/3 TALL GLASS CANDLE HOLDER PINK,6
ENAMEL BLUE RIM TEA CONTAINER,6
SET 12 COLOUR PENCILS DOILEY,6
BLACK CHERRY LIGHTS,6
NEW BAROQUE BLACK BOXES,6
FIRE POLISHED GLASS NECKL BRONZE,6
PINK POODLE HANGING DECORATION ,6
3 BLACK CATS W HEARTS BLANK CARD,6
PINK COMBO MINI CRYSTALS NECKLACE,6
GLASS BEAD HOOP NECKLACE AMETHYST,6
CHECK,6
GINGHAM OVEN GLOVE RED HEART ,6
POTTING SHED CANDLE CITRONELLA,6
SET 10 CARDS RUDOLPHS NOSE 17097,6
VINTAGE PHOTO ALBUM PARIS DAYS,6
SET/4 GARDEN ROSE DINNER CANDLE,6
RUSTIC STRAWBERRY JAMPOT SMALL,6
3 WICK CHRISTMAS BRIAR CANDLE ,6
VINTAGE GLASS TEA CADDY,6
HANGING HEART BASKET,6
ANTIQUE MID BLUE FLOWER EARRINGS,6
IVORY GOLD METAL BAG CHARM,6
LILAC VOTIVE CANDLE,6
RETO LEAVES MAGNETIC SHOPPING LIST,6
OLD DOC RUSSEL METAL SIGN,6
PINK MURANO TWIST BRACELET,6
PSYCHEDELIC METAL SIGN CALENDAR,6
HEN HOUSE WITH CHICK STANDING,6
CLASSIC DIAMANTE NECKLACE JET,6
ASSTD RASTA KEY-CHAINS,6
CONGRATULATIONS BUNTING,6
GLASS BEAD HOOP NECKLACE GREEN,6
GLASS BEAD HOOP EARRINGS MONTANA,6
FLOWER PURPLE CLOCK W/SUCKER,6
AMBER CRYSTAL DROP EARRINGS,6
PURPLE LAS VEGAS BRACELET ROUND,6
"ACRYLIC JEWEL ICICLE, BLUE",6
mailout,6
BAROQUE BUTTERFLY EARRINGS PINK,6
YELLOW PINK FLOWER DESIGN BIG BOWL,6
GLASS BEAD HOOP NECKLACE MONTANA,6
"PEARL & SHELL 42""NECKL. GREEN",6
EIGHT PIECE CREEPY CRAWLIE SET,6
GLASS BEAD HOOP EARRINGS BLACK,6
RED STONE/CRYSTAL EARRINGS,6
PURPLE FINE BEAD NECKLACE W TASSEL,6
PINK NEW BAROQUE FLOCK CANDLESTICK,6
ROUND ARTICULATED PINK CLOCK W/SUCK,6
FIRE POLISHED GLASS BRACELET RED,6
WHITE HYDRANGEA ART FLOWER,6
UNION JACK HOT WATER BOTTLE ,6
LIGHT TOPAZ TEAL/AQUA COL NECKLACE,6
SET OF 6 ICE CREAM SKITTLES,6
RABBIT EASTER DECORATION,6
DOORKNOB CRACKED GLAZE BLUE,6
GLITTER SNOW PEAR TREE DECORATION,6
VINTAGE BEAD PINK JEWEL BOX,6
BLUE CRUSOE CHECK LAMPSHADE,6
HEARTS WRAPPING TAPE ,6
SILVER/BLACK PENDANT ORBIT NECKLACE,6
NEW BAROQUE B'FLY NECKLACE GREEN,6
MONTANA DIAMOND CLUSTER NECKLACE,6
DIAMANTE NECKLACE GREEN,6
PINK/WHITE RIBBED MELAMINE JUG,6
PINK CHERRY LIGHTS,6
GLASS SONGBIRD STORAGE JAR,6
LIGHT PINK FLOCK GLASS CANDLEHOLDER,6
SET 10 CARDS CHRISTMAS HOLLY  17259,6
PURPLE VINTAGE EARRINGS,6
PAPER LANTERN 9 POINT HOLLY STAR 40,6
test,6
ANTIQUE SILVER BOOK MARK WITH BEADS,6
WHITE WITH BLACK CATS PLATE,6
BLUE BUNNY EASTER EGG BASKET,6
BLACK DIAMOND CLUSTER EARRINGS,6
PINK FEATHERS CURTAIN,6
BLACK DIAMOND CLUSTER NECKLACE,6
BLACK DROP CRYSTAL NECKLACE,6
PURPLE CRYSTAL DROP EARRINGS,6
BLUE STRIPES SHOULDER BAG,6
AMAZON,6
RESIN BRACELET W PASTEL BEADS,6
High Resolution Image,6
BLUE BREAKFAST CUP AND SAUCER ,6
BISCUIT TIN VINTAGE LEAF,6
BLUE LEAVES AND BEADS PHONE CHARM,4
GOLD COSMETIC BAG PINK STAR,4
returned,4
"POCKET MIRROR ""GLAMOROUS""",4
printing smudges/thrown away,4
FOLDING MIRROR RED  ,4
PACK OF 12 DOILEY TISSUES,4
BLACK VINT ART DEC CRYSTAL BRACELET,4
NEW ENGLAND MUG W GIFT BOX,4
FUNKY FLOWER PICNIC BAG FOR 4,4
WHITE BIRD GARDEN DESIGN MUG,4
VINTAGE BEAD PINK SHADE ,4
CHAMPAGNE TRAY BLANK CARD,4
incorrect stock entry.,4
PINK LEAVES AND BEADS PHONE CHARM,4
SET OF 16 VINTAGE IVORY CUTLERY,4
CHILDRENS SPACEBOY MUG,4
COPPER AND BRASS BAG CHARM,4
"SILICON CUBE 25W, BLUE",4
BLUE SHARK HELICOPTER,4
CANDY SPOT TEA COSY,4
ZINC T-LIGHT HOLDER STARS LARGE,4
60 GOLD AND SILVER FAIRY CAKE CASES,4
wet rusty,4
POP ART PUSH DOWN RUBBER ,4
KNITTED RABBIT DOLL ,4
DOTCOMGIFTSHOP TEA TOWEL,4
FROG KING WATERING CAN,4
PINK/AMETHYST/GOLD NECKLACE,4
Dr. Jam's Arouzer Stress Ball,4
ORANGE PENDANT TRIPLE SHELL NECKLAC,4
FOLDING SHOE TIDY,4
PINK FLOCK SUEDE CUSHION COVER ,4
mixed up,4
stock check,4
DOLLY GIRL MINI RUCKSACK,4
DUSTY PINK CHRISTMAS TREE 60CM,4
rusty throw away,4
BAROQUE BUTTERFLY EARRINGS BLACK,4
"PAPER CRAFT , LITTLE BIRDIE",4
YELLOW/ORANGE FLOWER DESIGN PLATE,4
DANISH ROSE UMBRELLA STAND,4
GREEN LEAVES AND BEADS PHONE CHARM,4
wet/rusty,4
BLACK SIL'T SQU CANDLE PLATE ,4
WHITE SILVER NECKLACE SHELL GLASS,4
SILVER AND BLACK ORBIT NECKLACE,4
FLAG OF ST GEORGE CAR FLAG,4
PASTEL BLUE PHOTO ALBUM ,4
BLUE MONTE CARLO HANDBAG,4
FOLKART CHRISTMAS TREE T-LIGHT HOLD,4
RED PURSE WITH PINK HEART,4
PICNIC BASKET WICKER 60 PIECES,4
ST GEORGE SET OF 10 PARTY LIGHTS,4
SUNJAR LED NIGHT NIGHT LIGHT,4
BAKING MOULD CHOCOLATE CUP CAKES,4
CROCHET DOG KEYRING,4
DOORKNOB CRACKED GLAZE PINK,4
3 BIRDS CANVAS SCREEN,4
ENAMEL BOWL PANTRY,4
GOLD FLOWER CUSHION COVER ,4
ROBOT MUG IN DISPLAY BOX,4
ROSE PENDANT TRIPLE SHELL NECKLACE,4
I LOVE LONDON WALL ART,4
CRACKED GLAZE NECKLACE BROWN,4
HAPPY BIRTHDAY CARD STRIPEY TEDDY,4
*USB Office Mirror Ball,4
Adjustment,4
PALE PINK/AMETHYST STONE NECKLACE,4
GOLD M.O.P. ORBIT NECKLACE,4
MAXWELL 2 TONE BLUE 60 PAGE PHOTO A,4
???missing,4
HEART SHAPED MIRROR,4
?missing,4
PASTEL PINK PHOTO ALBUM ,4
CLASSIC CROME BICYCLE BELL ,4
SET OF 3 MINI HANGING PORTRAITS,4
"WALL ART , LOVES' SECRET ",4
SET/3 FLORAL GARDEN TOOLS IN BAG,4
CUTE BIRD CEATURE SCREEN,4
GIFT BAG LARGE 50'S CHRISTMAS,4
GOLD APERITIF GLASS,4
ORANGE FLOWER MUG ,4
S/3 POT POURI CUSHIONS BLUE COLOURS,4
SMALL TAHITI BEACH BAG,4
POTTING SHED SOW 'N' GROW SET,4
ROSE FLOWER CANDLE+INCENSE 16X16CM,4
CROCHET ROSE DES CLOTHES HANGER,4
BUTTERFLY CUSHION COVER,4
DIAMANTE NECKLACE,4
KEEP CALM BIRTHDAY WRAP,4
"FLOWER GLASS GARLAND NECKL.36""GREEN",4
Dad's Cab Electronic Meter,4
WRAP GREEN RUSSIAN FOLKART ,4
S/2 BEACH HUT TREASURE CHESTS,4
CANNABIS LEAF BEAD CURTAIN,4
GREEN CRYSTAL DROP EARRINGS,4
GREEN POP ART MAO CUSHION COVER ,4
counted,4
CANNISTER VINTAGE LEAF DESIGN,4
LARGE ROUND CUTGLASS CANDLESTICK,4
BLUE TEATIME PRINT BOWL ,4
NEW BAROQUE B'FLY NECKLACE PINK,4
"WALL ART ,PUDDINGS ",4
VINTAGE NOTEBOOK BEAUTY GIRL,4
UBO-LIGHT TRIOBASE BLUE,4
LARGE PARLOUR FRAME,4
MEDIUM PARLOUR FRAME ,4
ANTIQUE LILY FAIRY LIGHTS,4
PURPLE LEAVES AND BEADS PHONE CHAR,4
taig adjust,4
SET 10 MINICARDS CUTE SNOWMAN 17071,4
STORAGE TIN VINTAGE DOILEY ,4
CLASSICAL ROSE TABLE LAMP,4
GIANT MEDINA STAMPED METAL BOWL ,4
SILVER LOOKING MIRROR,4
WHITE CHRISTMAS TREE 60CM,4
ENGLISH ROSE SCENTED HANGING HEART,4
damages wax,4
ENAMEL JUG PANTRY,4
ORANGE/WHT/FUSCHIA STONES NECKLACE,4
GOLD PRINT PAPER BAG,4
sold as 1,4
SILVER/BLACK ORBIT NECKLACE,4
BROWN VINTAGE VICTORIAN EARRINGS,4
WHITE CHRISTMAS FLOCK DROPLET ,4
CREAM SWEETHEART MAGAZINE RACK,4
PINK/WHITE CHRISTMAS TREE 30CM,4
BLUE FELT HANGING HEART W FLOWER,4
METAL BASE FOR CANDLES,4
SET 10 CARDS ROBIN WATERPUMP  17096,4
CUTE RABBIT CEATURE SCREEN ,4
BLUE/GREEN SHELL NECKLACE W PENDANT,4
FOLDING MIRROR IVORY ,4
Dotcom sales,4
SET 10 CARDS DECK THE HALLS 16960,4
incorrectly credited C550456 see 47,4
BLACK FLOWER CANDLE PLATE,4
LEAVES MAGNETIC  SHOPPING LIST,4
CORDIAL JUG,4
DAIRY MAID  PUDDING BOWL,4
wrongly coded 20713,4
WOODLAND MINI RUCKSACK ,4
FRESHWATER PEARL BRACELET GOLD,4
PURPLE/BLUE CERAMIC CANDLE HOLDER,4
crushed,4
WHITE WIRE PLANT POT HOLDER,4
"ACRYLIC JEWEL ANGEL,PINK",4
SET 10 CARDS XMAS GRAPHIC  17218,4
SET 10 CARDS POINSETTIA 17093,4
VINTAGE POST OFFICE CABINET,4
NEW BAROQUE B'FLY NECKLACE MONTANA,4
SILVER 2 STRAND NECKLACE-LEAF CHARM,4
reverse 21/5/10 adjustment,4
PINK SWEETIE NECKLACE,4
SET 10 MINI SANTA & SNOWMAN  17087,4
LARGE TAHITI BEACH BAG,4
WRAP A PRETTY THANK YOU,4
PINK FLUFFY CHRISTMAS DECORATION,4
TEA TIME TEA TOWELS ,4
PLAYING CARDS VINTAGE DOILEY ,4
GLASS CAKE COVER AND PLATE,4
WRAP  VINTAGE DOILEY ,4
SMALL PARLOUR FRAME,4
DOORKNOB CRACKED GLAZE GREEN,4
PINK BOUDOIR T-LIGHT HOLDER,2
SET OF 6 EASTER RAINBOW CHICKS,2
found some more on shelf,2
wet,2
VINTAGE BEAD PINK JEWEL STAND,2
BLACK CHRISTMAS FLOCK DROPLET ,2
PINK DOLLY HAIR CLIPS,2
SET/5 RED SPOTTY LID GLASS BOWLS,2
TEA TIME CAKE STAND IN GIFT BOX,2
CHRISTMAS CRAFT HEART STOCKING ,2
INCENSE BAZAAR PEACH,2
TINY CRYSTAL BRACELET RED,2
wrongly sold (22719) barcode,2
WHITE CHERRY LIGHTS,2
faulty,2
"WALL ART,ONLY ONE PERSON ",2
amazon adjust,2
wrong code,2
HAPPY BIRTHDAY CARD TEDDY/CAKE,2
HEAVENS SCENT FRAGRANCE OILS ASSTD,2
FLOWER FAIRY 5 SUMMER DRAW LINERS,2
SET OF 4 KNICK KNACK TINS  DOILEY ,2
lost??,2
Display,2
"RUBY GLASS NECKLACE 42""",2
Dotcom sold in 6's,2
PINK BEADS+HAND PHONE CHARM,2
mouldy,2
BAKING MOULD CUPCAKE CHOCOLATE,2
Dotcom,2
CAKE STAND LACE WHITE,2
temp adjustment,2
Found by jackie,2
crushed ctn,2
OPULENT VELVET SET/3 CANDLES,2
CHRISTMAS TABLE CANDLE SILVER SPIKE,2
Wrongly mrked had 85123a in box,2
found box,2
????damages????,2
PORCELAIN HANGING BELL SMALL,2
damages/showroom etc,2
samples,2
NECKLACE+BRACELET SET PINK DAISY,2
PINK ACRYLIC JEWEL SNOWFLAKE,2
WOOLLY HAT SOCK GLOVE ADVENT STRING,2
CAT WITH SUNGLASSES BLANK CARD,2
wrongly marked,2
FILIGREE DIAMANTE CHAIN,2
sold as set/6 by dotcom,2
wrongly coded 23343,2
???lost,2
PINK FEATHER CHRISTMAS DECORATION,2
John Lewis,2
PINK CHERRY BLOSSOM CUP & SAUCER,2
SET 36 COLOURING PENCILS DOILEY,2
GLASS BEAD HOOP NECKLACE BLACK,2
JAM JAR WITH BLUE LID,2
ZINC STAR T-LIGHT HOLDER ,2
lost in space,2
FOUND,2
for online retail orders,2
Found in w/hse,2
PAINTED HEART WREATH WITH BELL,2
did  a credit  and did not tick ret,2
mailout ,2
wrongly sold sets,2
Damages/samples,2
WHITE WITH METAL BAG CHARM,2
PINK/WHITE GLASS DEMI CHOKER,2
rcvd be air temp fix for dotcom sit,2
sold as set on dotcom and amazon,2
barcode problem,2
?lost,2
AMBER BERTIE MOBILE PHONE CHARM,2
RED ROSE AND LACE C/COVER,2
PINK LARGE JEWELED PHOTOFRAME,2
GREEN WITH METAL BAG CHARM,2
website fixed,2
FUNKY MONKEY MUG,2
WHITE DOVE HONEYCOMB PAPER GARLAND,2
crushed boxes,2
4 GOLD FLOCK CHRISTMAS BALLS,2
BIG POLKADOT MUG,2
PINK BAROQUE FLOCK CANDLE HOLDER,2
DOLPHIN WINDMILL,2
missing?,2
wrongly marked. 23343 in box,2
HOT WATER BOTTLE BABUSHKA LARGE,2
throw away,2
MINT DINER CLOCK,2
GOLD COSMETICS BAG WITH BUTTERFLY,2
CREAM SWEETHEART TRAYS,2
SET 10 CARDS CHRISTMAS BAUBLE 16954,2
Sold as 1 on dotcom,2
SET 10 CARDS SWIRLY XMAS TREE 17104,2
Missing,2
WHITE FRANGIPANI HAIR CLIP,2
BIRTHDAY BANNER TAPE,2
?sold as sets?,2
wet boxes,2
"PEARL & SHELL 42""NECKL. IVORY",2
HAYNES CAMPER SHOULDER BAG,2
PINK FLOCK PHOTO FRAME ,2
taig adjust no stock,2
ORANGE FELT VASE + FLOWERS,2
ASSORTED TUTTI FRUTTI ROUND BOX,2
SET 10 CARDS 3 WISE MEN 17107,2
came coded as 20713,2
CREAM SWEETHEART SHELF + HOOKS,2
sold as set by dotcom,2
wet?,2
FRYING PAN RED POLKADOT ,2
WIRE FLOWER T-LIGHT HOLDER,2
Marked as 23343,2
BEADED LOVE HEART JEWELLERY SET,2
ANT SILVER TURQUOISE BOUDICCA RING,2
OOPS ! adjustment,2
cracked,2
CRYSTAL CHANDELIER T-LIGHT HOLDER,2
LARGE BLACK DIAMANTE HAIRSLIDE,2
PINK BERTIE MOBILE PHONE CHARM,2
"MERCHANT CHANDLER CREDIT ERROR, STO",2
20713,2
FIRE POLISHED GLASS NECKL GOLD,2
DAMAGED,2
water damage,2
WET/MOULDY,2
reverse previous adjustment,2
"mouldy, thrown away.",2
SET 12 COLOURING PENCILS DOILEY,2
SET/4 2 TONE EGG SHAPE MIXING BOWLS,2
mix up with c,2
dotcomstock,2
wrongly marked carton 22804,2
"GARLAND, MAGIC GARDEN 1.8M",2
GIRLY PINK TOOL SET,2
damages/dotcom?,2
Thrown away.,2
BIRD ON BRANCH CANVAS SCREEN,2
*Boombox Ipod Classic,2
to push order througha s stock was ,2
S/4 BLACK DISCO PARTITION PANEL,2
BLUE NEW BAROQUE FLOCK CANDLESTICK,2
amazon sales,2
COUNTRY COTTAGE  DOORSTOP GREEN,2
BAKING MOULD TOFFEE CUP  CHOCOLATE,2
EASTER CRAFT IVY WREATH WITH CHICK,2
BLUE CRYSTAL BOOT PHONE CHARM,2
wrong barcode (22467),2
BELL HEART ANTIQUE GOLD,2
FLOWER SHOP DESIGN MUG,2
thrown away-can't sell.,2
LILY BROOCH WHITE/SILVER COLOUR,2
PURPLE CHUNKY GLASS+BEAD NECKLACE,2
ASSORTED COLOUR SILK GLASSES CASE,2
Sale error,2
dotcom adjust,2
dotcom sales,2
SET 10 CARD CHRISTMAS STAMPS 16963,2
Dotcomgiftshop Gift Voucher 100.00,2
adjust,2
POLYESTER FILLER PAD 60x40cm,2
"ACRYLIC JEWEL SNOWFLAKE,PINK",2
incorrectly put back into stock,2
MIA,2
HEN HOUSE W CHICK IN NEST,2
re-adjustment,2
re dotcom quick fix.,2
wrong code?,2
MARIE ANTOIENETT TRINKET BOX GOLD,2
"WALL ART , THE MAGIC FOREST ",2
sold as 22467,2
BLOSSOM IMAGES SCRAP BOOK SET,2
wrong barcode,2
CAPIZ CHANDELIER,2
Thrown away-rusty,2
MISELTOE HEART WREATH CREAM,2
"BREAD BIN, DINER STYLE, IVORY",2
Wet pallet-thrown away,2
OCEAN STRIPE HAMMOCK ,2
Dagamed,2
 TOADSTOOL BEDSIDE LIGHT ,2
"BREAD BIN, DINER STYLE, MINT",2
sold in set?,2
POSSIBLE DAMAGES OR LOST?,2
BLACKCHRISTMAS TREE 30CM,2
Incorrect stock entry.,2
damaged stock,2
ROCOCO WALL MIROR,2
allocate stock for dotcom orders ta,2
PINK ALLIUM  ARTIFICIAL FLOWER,2
add stock to allocate online orders,2
"mouldy, unsaleable.",2
SET 10 CARDS SNOWY ROBIN 17099,2
Show Samples,2
lost,2
?display?,2
????missing,2
LUNCH BAG RED SPOTTY,2
Breakages,2
on cargo order,2
"LETTER ""U"" BLING KEY RING",2
FLAMINGO LIGHTS,2
PINK POLKADOT KIDS BAG,2
Given away,2
can't find,2
PINK CRYSTAL GUITAR PHONE CHARM,2
???,2
VINTAGE GOLD TINSEL REEL,2
CAMOUFLAGE DOG COLLAR,2
IVORY PANTRY HANGING LAMP ,2
TRAVEL CARD WALLET DOTCOMGIFTSHOP,2
? sold as sets?,2
WATERING CAN SINGLE HOOK PISTACHIO,2
PURPLE ANEMONE ARTIFICIAL FLOWER,2
SWEETHEART KEY CABINET,2
broken,2
sold with wrong barcode,2
CURIOUS IMAGES SCRAP BOOK SET,2
72 CAKE CASES VINTAGE CHRISTMAS,2
dotcom sold sets,2
ORANGE/FUSCHIA STONES NECKLACE,2
 I LOVE LONDON MINI RUCKSACK,2
SCALLOP SHELL SOAP DISH,2
GREEN PENDANT SHELL NECKLACE,2
BLACK GLASS/SHELL/PEARL NECKLACE,2
SET OF THREE VINTAGE GIFT WRAPS,2
SET/6 IVORY BIRD T-LIGHT CANDLES,2
michel oops,2
GLASS BELL JAR SMALL,2
rusty thrown away,2
Dotcom set,2
PINK PAINTED KASHMIRI CHAIR,2
BAROQUE BUTTERFLY EARRINGS MONTANA,2
SET OF 3 PINK FLYING DUCKS,2
CROCHET LILAC/RED BEAR KEYRING,2
Printing smudges/thrown away,2
M/COLOUR POM-POM CURTAIN,2
OCEAN SCENT CANDLE JEWELLED DRAWER,2
GARDENERS KNEELING PAD,2
ZINC PLANT POT HOLDER,2
PINK CHRYSANTHEMUMS ART FLOWER,2
ENAMEL MUG PANTRY,2
DUSTY PINK CHRISTMAS TREE 30CM,2
BLUE PAINTED KASHMIRI CHAIR,2
SET 10 CARDS 12 DAYS OF XMAS 17059,2
damages/credits from ASOS.,2
Not rcvd in 10/11/2010 delivery,2
stock creditted wrongly,2
Had been put aside.,2
PEG BAG APPLE DESIGN,2
code mix up? 84930,2
PACK 4 FLOWER/BUTTERFLY PATCHES,2
LASER CUT MULTI STRAND NECKLACE,2
RUBY GLASS CLUSTER NECKLACE,2
?? missing,2
JARDIN ETCHED GLASS BUTTER DISH,2
DOORKNOB CERAMIC IVORY,2
wrongly sold as sets,2
