index,ItemDescription
WHITE HANGING HEART T-LIGHT HOLDER,4738
REGENCY CAKESTAND 3 TIER,4400
JUMBO BAG RED RETROSPOT,4318
PARTY BUNTING,3454
LUNCH BAG RED RETROSPOT,3276
ASSORTED COLOUR BIRD ORNAMENT,3002
SET OF 3 CAKE TINS PANTRY DESIGN ,2946
PACK OF 72 RETROSPOT CAKE CASES,2770
LUNCH BAG  BLACK SKULL.,2700
NATURAL SLATE HEART CHALKBOARD ,2560
POSTAGE,2504
JUMBO BAG PINK POLKADOT,2502
HEART OF WICKER SMALL,2474
JAM MAKING SET WITH JARS,2458
JUMBO STORAGE BAG SUKI,2428
PAPER CHAIN KIT 50'S CHRISTMAS ,2420
JUMBO SHOPPER VINTAGE RED PAISLEY,2404
LUNCH BAG CARS BLUE,2394
LUNCH BAG SPACEBOY DESIGN ,2384
JAM MAKING SET PRINTED,2364
RECIPE BOX PANTRY YELLOW DESIGN,2360
SPOTTY BUNTING,2344
LUNCH BAG SUKI DESIGN ,2278
ROSES REGENCY TEACUP AND SAUCER ,2276
LUNCH BAG PINK POLKADOT,2274
WOODEN PICTURE FRAME WHITE FINISH,2258
SET OF 4 PANTRY JELLY MOULDS,2222
ALARM CLOCK BAKELIKE RED ,2214
GREEN REGENCY TEACUP AND SAUCER,2170
LUNCH BAG APPLE DESIGN,2168
VICTORIAN GLASS HANGING T-LIGHT,2144
RED RETROSPOT CHARLOTTE BAG,2136
LUNCH BAG WOODLAND,2122
RABBIT NIGHT LIGHT,2102
ALARM CLOCK BAKELIKE GREEN,2048
SET/20 RED RETROSPOT PAPER NAPKINS ,2030
JUMBO BAG APPLES,2018
WOODEN FRAME ANTIQUE WHITE ,1998
RETROSPOT TEA SET CERAMIC 11 PC ,1976
6 RIBBONS RUSTIC CHARM,1972
BAKING SET 9 PIECE RETROSPOT ,1948
REX CASH+CARRY JUMBO SHOPPER,1934
HEART OF WICKER LARGE,1922
JUMBO  BAG BAROQUE BLACK WHITE,1920
VINTAGE SNAP CARDS,1888
GARDENERS KNEELING PAD KEEP CALM ,1874
SET/5 RED RETROSPOT LID GLASS BOWLS,1872
JUMBO BAG ALPHABET,1860
SPACEBOY LUNCH BOX ,1848
SET OF 3 REGENCY CAKE TINS,1838
CHARLOTTE BAG SUKI DESIGN,1822
PACK OF 60 PINK PAISLEY CAKE CASES,1792
JUMBO BAG VINTAGE LEAF,1790
CHOCOLATE HOT WATER BOTTLE,1778
JUMBO BAG PINK VINTAGE PAISLEY,1770
DOLLY GIRL LUNCH BOX,1762
JUMBO BAG WOODLAND ANIMALS,1756
PLEASE ONE PERSON METAL SIGN,1750
RED TOADSTOOL LED NIGHT LIGHT,1748
60 TEATIME FAIRY CAKE CASES,1742
SET OF 6 SPICE TINS PANTRY DESIGN,1740
POPCORN HOLDER,1730
WOODLAND CHARLOTTE BAG,1716
JUMBO BAG STRAWBERRY,1700
PAPER CHAIN KIT VINTAGE CHRISTMAS,1700
PINK REGENCY TEACUP AND SAUCER,1658
HOT WATER BOTTLE KEEP CALM,1626
PAPER BUNTING RETROSPOT,1624
ALARM CLOCK BAKELIKE PINK,1620
HOME BUILDING BLOCK WORD,1612
SCOTTIE DOG HOT WATER BOTTLE,1596
CLOTHES PEGS RETROSPOT PACK 24 ,1584
LUNCH BAG ALPHABET DESIGN,1560
GARDENERS KNEELING PAD CUP OF TEA ,1560
CHARLOTTE BAG PINK POLKADOT,1554
GIN + TONIC DIET METAL SIGN,1550
RED HANGING HEART T-LIGHT HOLDER,1546
STRAWBERRY CERAMIC TRINKET BOX,1540
HANGING HEART JAR T-LIGHT HOLDER,1534
ROUND SNACK BOXES SET OF4 WOODLAND ,1528
RECYCLING BAG RETROSPOT ,1520
LUNCH BOX I LOVE LONDON,1500
COOK WITH WINE METAL SIGN ,1490
STRAWBERRY CHARLOTTE BAG,1484
DOORMAT KEEP CALM AND COME IN,1484
IVORY KITCHEN SCALES,1482
JUMBO BAG 50'S CHRISTMAS ,1478
JUMBO BAG VINTAGE DOILY ,1474
PLASTERS IN TIN WOODLAND ANIMALS,1458
GUMBALL COAT RACK,1456
JUMBO STORAGE BAG SKULLS,1440
ANTIQUE SILVER T-LIGHT GLASS,1438
DOTCOM POSTAGE,1418
PACK OF 20 NAPKINS PANTRY DESIGN,1418
DOORMAT RED RETROSPOT,1414
SET OF 3 BUTTERFLY COOKIE CUTTERS,1414
LUNCH BAG DOLLY GIRL DESIGN,1412
JUMBO BAG SPACEBOY DESIGN,1404
SET OF 3 HEART COOKIE CUTTERS,1400
WOOD BLACK BOARD ANT WHITE FINISH,1396
PLASTERS IN TIN SPACEBOY,1394
LUNCH BAG VINTAGE LEAF DESIGN,1384
GINGERBREAD MAN COOKIE CUTTER,1382
HAND WARMER OWL DESIGN,1374
HAND OVER THE CHOCOLATE   SIGN ,1372
CHILLI LIGHTS,1358
HOT WATER BOTTLE I AM SO POORLY,1358
PACK OF 72 SKULL CAKE CASES,1356
RED  HARMONICA IN BOX ,1352
JUMBO BAG SCANDINAVIAN BLUE PAISLEY,1350
JUMBO BAG OWLS,1346
SET OF 60 PANTRY DESIGN CAKE CASES ,1318
SMALL WHITE HEART OF WICKER,1314
HOT WATER BOTTLE TEA AND SYMPATHY,1312
LOVE BUILDING BLOCK WORD,1312
RETROSPOT HEART HOT WATER BOTTLE,1310
HOMEMADE JAM SCENTED CANDLES,1310
60 CAKE CASES VINTAGE CHRISTMAS,1304
72 SWEETHEART FAIRY CAKE CASES,1300
HOT BATHS METAL SIGN,1286
BATHROOM METAL SIGN,1282
PACK OF 60 DINOSAUR CAKE CASES,1282
SET OF 20 VINTAGE CHRISTMAS NAPKINS,1280
COLOUR GLASS T-LIGHT HOLDER HANGING,1280
PINK CREAM FELT CRAFT TRINKET BOX ,1266
DOORMAT UNION FLAG,1254
TRADITIONAL KNITTING NANCY,1250
LUNCH BAG VINTAGE DOILY ,1248
PAPER CHAIN KIT RETROSPOT,1238
VINTAGE HEADS AND TAILS CARD GAME ,1234
BLUE HARMONICA IN BOX ,1230
HANGING HEART ZINC T-LIGHT HOLDER,1224
SMALL POPCORN HOLDER,1222
ROUND SNACK BOXES SET OF 4 FRUITS ,1222
JUMBO BAG PEARS,1216
DOORMAT NEW ENGLAND,1216
WOODEN BOX OF DOMINOES,1214
BOX OF 24 COCKTAIL PARASOLS,1206
WOOD 2 DRAWER CABINET WHITE FINISH,1200
DOORMAT HEARTS,1198
STRAWBERRY LUNCH BOX WITH CUTLERY,1196
GREY HEART HOT WATER BOTTLE,1190
CHARLOTTE BAG APPLES DESIGN,1188
ALARM CLOCK BAKELIKE IVORY,1188
LARGE WHITE HEART OF WICKER,1186
PLASTERS IN TIN SKULLS,1186
PLASTERS IN TIN CIRCUS PARADE ,1182
PLASTERS IN TIN VINTAGE PAISLEY ,1178
RED RETROSPOT SHOPPER BAG,1172
HAND WARMER SCOTTY DOG DESIGN,1170
SMALL GLASS HEART TRINKET POT,1170
RED RETROSPOT CAKE STAND,1168
RED KITCHEN SCALES,1154
HAND WARMER BIRD DESIGN,1148
CHILDRENS APRON SPACEBOY DESIGN,1146
Manual,1144
FELTCRAFT 6 FLOWER FRIENDS,1136
SET OF 12 FAIRY CAKE BAKING CASES,1134
CHRISTMAS CRAFT LITTLE FRIENDS,1126
LOVEBIRD HANGING DECORATION WHITE ,1120
WOODEN HEART CHRISTMAS SCANDINAVIAN,1114
TRAVEL CARD WALLET KEEP CALM,1114
CREAM SWEETHEART MINI CHEST,1110
ZINC METAL HEART DECORATION,1104
EDWARDIAN PARASOL NATURAL,1102
POTTERING IN THE SHED METAL SIGN,1094
RED RETROSPOT PICNIC BAG,1092
SMALL DOLLY MIX DESIGN ORANGE BOWL,1092
SWEETHEART CERAMIC TRINKET BOX,1086
WORLD WAR 2 GLIDERS ASSTD DESIGNS,1084
PINK BLUE FELT CRAFT TRINKET BOX,1076
CREAM HEART CARD HOLDER,1072
PACK OF 60 SPACEBOY CAKE CASES,1070
WOODEN STAR CHRISTMAS SCANDINAVIAN,1070
PLASTERS IN TIN STRONGMAN,1068
PHOTO FRAME CORNICE,1066
SET OF 20 KIDS COOKIE CUTTERS,1066
SET/6 RED SPOTTY PAPER PLATES,1064
SUKI  SHOULDER BAG,1064
JUMBO BAG TOYS ,1064
SPACEBOY BIRTHDAY CARD,1062
PACK OF 12 LONDON TISSUES ,1062
ENAMEL FLOWER JUG CREAM,1056
ASSORTED COLOURS SILK FAN,1046
JUMBO BAG DOILEY PATTERNS,1044
WHITE SKULL HOT WATER BOTTLE ,1036
HAND WARMER UNION JACK,1030
SET OF 72 PINK HEART PAPER DOILIES,1028
FAWN BLUE HOT WATER BOTTLE,1026
NATURAL SLATE CHALKBOARD LARGE ,1022
SINGLE HEART ZINC T-LIGHT HOLDER,1020
SET OF TEA COFFEE SUGAR TINS PANTRY,1018
FELTCRAFT BUTTERFLY HEARTS,1012
RED RETROSPOT PEG BAG,1012
DOORMAT FANCY FONT HOME SWEET HOME,1012
METAL 4 HOOK HANGER FRENCH CHATEAU,1012
NO SINGING METAL SIGN,1010
LUNCH BAG DOILEY PATTERN ,1010
PANTRY MAGNETIC  SHOPPING LIST,1006
LOVE HOT WATER BOTTLE,1004
PINK FAIRY CAKE CHILDRENS APRON,1002
RECIPE BOX RETROSPOT ,998
4 TRADITIONAL SPINNING TOPS,996
LUNCH BOX WITH CUTLERY RETROSPOT ,996
JUMBO BAG VINTAGE CHRISTMAS ,992
SET/3 RED GINGHAM ROSE STORAGE BOX,988
SET OF 3 WOODEN HEART DECORATIONS,984
VINTAGE UNION JACK BUNTING,982
DOORMAT SPOTTY HOME SWEET HOME,978
SMALL HEART MEASURING SPOONS,978
FELTCRAFT CUSHION OWL,976
LADIES & GENTLEMEN METAL SIGN,970
3 STRIPEY MICE FELTCRAFT,966
BAKING SET SPACEBOY DESIGN,966
PARTY METAL SIGN ,964
TOY TIDY PINK POLKADOT,964
TEA TIME PARTY BUNTING,956
CHOCOLATE THIS WAY METAL SIGN,956
TRAVEL SEWING KIT,956
PICNIC BASKET WICKER SMALL,954
ZINC FOLKART SLEIGH BELLS,952
ROTATING SILVER ANGELS T-LIGHT HLDR,950
ALARM CLOCK BAKELIKE ORANGE,946
KNITTED UNION FLAG HOT WATER BOTTLE,946
CHRISTMAS CRAFT TREE TOP ANGEL,946
ENAMEL BREAD BIN CREAM,946
RED DINER WALL CLOCK,944
FELTCRAFT PRINCESS CHARLOTTE DOLL,938
YOU'RE CONFUSING ME METAL SIGN ,938
PICNIC BASKET WICKER LARGE,932
SCANDINAVIAN REDS RIBBONS,930
MEMO BOARD RETROSPOT  DESIGN,928
SMALL MARSHMALLOWS PINK BOWL,928
RED RETROSPOT OVEN GLOVE ,926
SET OF 72 RETROSPOT PAPER  DOILIES,924
SET OF 12 MINI LOAF BAKING CASES,920
RED RETROSPOT BOWL,918
CHARLOTTE BAG VINTAGE ALPHABET ,916
RED STRIPE CERAMIC DRAWER KNOB,916
REGENCY TEA PLATE ROSES ,916
BEWARE OF THE CAT METAL SIGN ,916
60 CAKE CASES DOLLY GIRL DESIGN,916
CLEAR DRAWER KNOB ACRYLIC EDWARDIAN,916
SCANDINAVIAN PAISLEY PICNIC BAG,914
SET OF 6 SOLDIER SKITTLES,910
JUMBO BAG DOLLY GIRL DESIGN,908
ALARM CLOCK BAKELIKE CHOCOLATE,906
VINTAGE PAISLEY STATIONERY SET,906
TOILET SIGN OCCUPIED OR VACANT,904
DOORMAT WELCOME TO OUR HOME,904
POPPY'S PLAYHOUSE KITCHEN,902
BLUE STRIPE CERAMIC DRAWER KNOB,902
TRADITIONAL WOODEN SKIPPING ROPE,902
PACK OF 12 TRADITIONAL CRAYONS,900
"SET 3 RETROSPOT TEA,COFFEE,SUGAR",898
WOODEN SCHOOL COLOURING SET,898
RED WOOLLY HOTTIE WHITE HEART.,898
PAPER CHAIN KIT EMPIRE,896
WHITE WOOD GARDEN PLANT LADDER,894
CARD BILLBOARD FONT,894
AREA PATROLLED METAL SIGN,890
SET OF 3 NOTEBOOKS IN PARCEL,882
IVORY DINER WALL CLOCK,882
SET OF 6 RIBBONS VINTAGE CHRISTMAS,880
SET/6 RED SPOTTY PAPER CUPS,878
SOLDIERS EGG CUP ,878
REGENCY TEAPOT ROSES ,876
POPPY'S PLAYHOUSE BEDROOM ,872
SET OF 60 I LOVE LONDON CAKE CASES ,870
PACK OF 12 HEARTS DESIGN TISSUES ,868
VINTAGE DOILY TRAVEL SEWING KIT,866
FLORAL FOLK STATIONERY SET,866
CHILDRENS CUTLERY POLKADOT PINK,862
RIBBON REEL STRIPES DESIGN ,858
VINTAGE CREAM DOG FOOD CONTAINER,858
FELTCRAFT PRINCESS LOLA DOLL,856
NATURAL SLATE RECTANGLE CHALKBOARD,854
SKULL LUNCH BOX WITH CUTLERY ,854
WHITE SPOT RED CERAMIC DRAWER KNOB,852
BOX OF 6 MINI 50'S CRACKERS,850
PINK VINTAGE PAISLEY PICNIC BAG,850
CHARLOTTE BAG DOLLY GIRL DESIGN,850
HAND WARMER RED LOVE HEART,850
TRADITIONAL WOODEN CATCH CUP GAME ,848
WOOD S/3 CABINET ANT WHITE FINISH,848
CHICK GREY HOT WATER BOTTLE,844
TRAVEL CARD WALLET VINTAGE TICKET,844
GINGHAM HEART DECORATION,844
METAL SIGN TAKE IT OR LEAVE IT ,844
PACK OF 6 BIRDY GIFT TAGS,840
STRAWBERRY SHOPPER BAG,840
WICKER STAR ,838
SET 6 SCHOOL MILK BOTTLES IN CRATE,836
FOUR HOOK  WHITE LOVEBIRDS,836
CANDLEHOLDER PINK HANGING HEART,832
DOORMAT ENGLISH ROSE ,832
VINTAGE CHRISTMAS BUNTING,830
SKULL SHOULDER BAG,826
AIRLINE BAG VINTAGE TOKYO 78,826
WOODEN UNION JACK BUNTING,824
CIRCUS PARADE LUNCH BOX ,822
TOILET METAL SIGN,822
PINK HAPPY BIRTHDAY BUNTING,820
RED SPOTTY BISCUIT TIN,818
PACK OF 60 MUSHROOM CAKE CASES,816
SWEETHEART CAKESTAND 3 TIER,814
CERAMIC STRAWBERRY CAKE MONEY BANK,812
BREAD BIN DINER STYLE IVORY,812
3 HOOK PHOTO SHELF ANTIQUE WHITE,806
SET/2 RED RETROSPOT TEA TOWELS ,806
ENAMEL MEASURING JUG CREAM,806
VINTAGE SNAKES & LADDERS,802
RED RETROSPOT CUP,800
FELTCRAFT CUSHION RABBIT,796
HAND WARMER RED RETROSPOT,790
PANTRY WASHING UP BRUSH,790
BLUE HAPPY BIRTHDAY BUNTING,788
SET OF 60 VINTAGE LEAF CAKE CASES ,788
ASSORTED COLOUR MINI CASES,788
SET OF 10 LED DOLLY LIGHTS,786
OPEN CLOSED METAL SIGN,784
SET/10 RED POLKADOT PARTY CANDLES,784
TRADITIONAL MODELLING CLAY,782
BOX OF 6 MINI VINTAGE CRACKERS,782
CHRISTMAS CRAFT WHITE FAIRY ,782
RED RETROSPOT MINI CASES,782
3 PIECE SPACEBOY COOKIE CUTTER SET,782
ENGLISH ROSE HOT WATER BOTTLE,780
MINI PAINT SET VINTAGE ,780
FAMILY ALBUM WHITE PICTURE FRAME,780
BLUE SPOT CERAMIC DRAWER KNOB,778
SET 7 BABUSHKA NESTING BOXES,778
SET OF 6 TEA TIME BAKING CASES,778
PACK OF 20 NAPKINS RED APPLES,778
HEART IVORY TRELLIS SMALL,778
RED SPOT CERAMIC DRAWER KNOB,776
REGENCY TEA PLATE GREEN ,776
EDWARDIAN PARASOL BLACK,776
BINGO SET,774
HAND WARMER BABUSHKA DESIGN,772
WHITE SPOT BLUE CERAMIC DRAWER KNOB,768
BLACK RECORD COVER FRAME,768
SET 2 PANTRY DESIGN TEA TOWELS,766
LARGE HEART MEASURING SPOONS,764
PAINTED METAL PEARS ASSORTED,764
"KEY FOB , SHED",760
COLOURING PENCILS BROWN TUBE,758
TREASURE TIN GYMKHANA DESIGN,758
MINT KITCHEN SCALES,758
RED RETROSPOT UMBRELLA,756
JINGLE BELL HEART DECORATION,754
MODERN FLORAL STATIONERY SET,752
SET 12 KIDS COLOUR  CHALK STICKS,752
SWEETHEART RECIPE BOOK STAND,750
SAVE THE PLANET MUG,748
12 PENCILS SMALL TUBE RED RETROSPOT,748
CHILDRENS CUTLERY SPACEBOY ,748
SET OF 4 KNICK KNACK TINS DOILY ,746
12 PENCIL SMALL TUBE WOODLAND,744
MULTI COLOUR SILVER T-LIGHT HOLDER,744
PACK OF 12 SUKI TISSUES ,744
BLUE DINER WALL CLOCK,744
CHILDRENS APRON APPLES DESIGN,744
I'M ON HOLIDAY METAL SIGN,744
ANTIQUE SILVER TEA GLASS ENGRAVED,742
RECIPE BOX BLUE SKETCHBOOK DESIGN,742
HANGING METAL HEART LANTERN,742
WASHROOM METAL SIGN,742
DOORMAT FAIRY CAKE,742
12 PENCILS SMALL TUBE SKULL,740
HOME SWEET HOME MUG,740
RED RETROSPOT SMALL MILK JUG,738
RETROSPOT CHILDRENS APRON,738
TEA PARTY BIRTHDAY CARD,738
"RECORD FRAME 7"" SINGLE SIZE ",738
SET OF 6 SNACK LOAF BAKING CASES,738
TRADITIONAL CHRISTMAS RIBBONS,736
SET 12 RETRO WHITE CHALK STICKS,734
REVOLVER WOODEN RULER ,734
JAM JAR WITH PINK LID,732
WOODEN ROUNDERS GARDEN SET ,732
SET OF 36 PAISLEY FLOWER DOILIES,732
ROLL WRAP 50'S CHRISTMAS,728
TEA BAG PLATE RED RETROSPOT,728
PICTURE DOMINOES,726
CERAMIC HEART FAIRY CAKE MONEY BANK,726
SET 20 NAPKINS FAIRY CAKES DESIGN ,726
HEART DECORATION RUSTIC HANGING ,726
T-LIGHT GLASS FLUTED ANTIQUE,722
RETROSPOT LARGE MILK JUG,722
ROBOT BIRTHDAY CARD,718
HANGING JAM JAR T-LIGHT HOLDER,718
BUNDLE OF 3 ALPHABET EXERCISE BOOKS,718
SET/10 PINK POLKADOT PARTY CANDLES,716
FELTCRAFT CUSHION BUTTERFLY,716
PIGGY BANK RETROSPOT ,714
LAUNDRY 15C METAL SIGN,712
JUMBO BAG PAISLEY PARK,710
AGED GLASS SILVER T-LIGHT HOLDER,710
BALLOONS  WRITING SET ,706
RED RETROSPOT ROUND CAKE TINS,704
WOODEN TREE CHRISTMAS SCANDINAVIAN,702
VINTAGE CHRISTMAS STOCKING ,702
PINK BABY BUNTING,702
ROLL WRAP VINTAGE CHRISTMAS,700
ENGLISH ROSE NOTEBOOK A7 SIZE,700
CLASSIC CAFE SUGAR DISPENSER,698
DOUGHNUT LIP GLOSS ,696
PLAYING CARDS KEEP CALM & CARRY ON,694
GIANT 50'S CHRISTMAS CRACKER,692
DELUXE SEWING KIT ,690
POTTERING MUG,690
SET OF 3 HANGING OWLS OLLIE BEAK,690
PLACE SETTING WHITE HEART,690
36 PENCILS TUBE RED RETROSPOT,690
FELTCRAFT DOLL MOLLY,688
FRENCH ENAMEL CANDLEHOLDER,688
SET OF 3 WOODEN STOCKING DECORATION,686
REGENCY MILK JUG PINK ,686
WATERING CAN BLUE ELEPHANT,686
REGENCY SUGAR BOWL GREEN,684
PACK OF 20 SKULL PAPER NAPKINS,684
PAPER BUNTING WHITE LACE,684
PINK POLKADOT BOWL,680
FELTCRAFT CHRISTMAS FAIRY,678
LUNCH BAG PAISLEY PARK  ,678
SET OF 36 TEATIME PAPER DOILIES,678
RED RETROSPOT WRAP ,678
CLASSIC GLASS COOKIE JAR,676
6 GIFT TAGS VINTAGE CHRISTMAS ,674
LANTERN CREAM GAZEBO ,672
POPPY'S PLAYHOUSE LIVINGROOM ,670
6 GIFT TAGS 50'S CHRISTMAS ,670
RETROSPOT PARTY BAG + STICKER SET,668
RIBBON REEL HEARTS DESIGN ,668
BLUE POLKADOT CUP,668
HEART IVORY TRELLIS LARGE,666
CHRISTMAS LIGHTS 10 REINDEER,666
IVORY HANGING DECORATION  HEART,662
PHOTO CUBE,662
EDWARDIAN PARASOL RED,660
SILVER HANGING T-LIGHT HOLDER,658
LONDON BUS COFFEE MUG,656
CHOCOLATE BOX RIBBONS ,656
WHITE METAL LANTERN,656
RIBBON REEL CHRISTMAS SOCK BAUBLE,654
BLUE POLKADOT BOWL,654
"FANCY FONT BIRTHDAY CARD, ",654
VINTAGE CREAM CAT FOOD CONTAINER,654
10 COLOUR SPACEBOY PEN,654
CHILDRENS CUTLERY RETROSPOT RED ,648
3 HEARTS HANGING DECORATION RUSTIC,646
ROTATING LEAVES T-LIGHT HOLDER,644
MEMO BOARD COTTAGE DESIGN,644
TEA TIME OVEN GLOVE,644
JAM JAR WITH GREEN LID,642
CHILDREN'S APRON DOLLY GIRL ,640
BISCUIT TIN 50'S CHRISTMAS,640
"KEY FOB , BACK DOOR ",640
SET OF 3 WOODEN TREE DECORATIONS,638
CARD DOLLY GIRL ,638
SET OF 3 WOODEN SLEIGH DECORATIONS,636
SET/20 STRAWBERRY PAPER NAPKINS ,636
CHARLIE+LOLA PINK HOT WATER BOTTLE,636
HEART FILIGREE DOVE  SMALL,634
POTTING SHED TEA MUG,632
ROLL WRAP VINTAGE SPOT ,632
REGENCY TEA PLATE PINK,630
PINK  POLKADOT CUP,626
SET 6 PAPER TABLE LANTERN HEARTS ,626
RED FLORAL FELTCRAFT SHOULDER BAG,622
RED RETROSPOT PLATE ,622
KITCHEN METAL SIGN,620
FELTCRAFT DOLL ROSIE,620
WHITE WICKER STAR ,618
RETROSPOT RED WASHING UP GLOVES,618
WOODEN CROQUET GARDEN SET,614
FULL ENGLISH BREAKFAST PLATE,614
GROW A FLYTRAP OR SUNFLOWER IN TIN,614
CHILDRENS CUTLERY DOLLY GIRL ,614
FRENCH WC SIGN BLUE METAL,612
ROUND SNACK BOXES SET OF 4 SKULLS,612
SET OF 6 HERB TINS SKETCHBOOK,610
DOORSTOP RETROSPOT HEART,608
LARGE CERAMIC TOP STORAGE JAR,608
BAG 125g SWIRLY MARBLES,608
GIN AND TONIC MUG,608
PACK OF 12 RED RETROSPOT TISSUES ,606
PANTRY SCRUBBING BRUSH,606
GRAND CHOCOLATECANDLE,606
FOOD CONTAINER SET 3 LOVE HEART ,606
HANGING HEART MIRROR DECORATION ,606
RED GINGHAM ROSE JEWELLERY BOX,604
JUMBO BAG CHARLIE AND LOLA TOYS,604
IVORY WICKER HEART LARGE,604
CLASSIC METAL BIRDCAGE PLANT HOLDER,602
SET OF 4 ENGLISH ROSE PLACEMATS,602
SET OF 3 CAKE TINS SKETCHBOOK,600
SLEEPING CAT ERASERS,596
TOY TIDY SPACEBOY  ,594
BREAD BIN DINER STYLE RED ,592
CHILDRENS CUTLERY POLKADOT BLUE,592
WALL TIDY RETROSPOT ,592
FELTCRAFT PRINCESS OLIVIA DOLL,590
VICTORIAN SEWING BOX SMALL ,590
JAZZ HEARTS PURSE NOTEBOOK,588
BLACK/BLUE POLKADOT UMBRELLA,588
WOODEN HAPPY BIRTHDAY GARLAND,588
PEG BAG APPLES DESIGN,588
WOOD STAMP SET THANK YOU,586
TRADITIONAL PICK UP STICKS GAME ,586
"AIRLINE LOUNGE,METAL SIGN",586
DOORMAT HOME SWEET HOME BLUE ,586
CREAM CUPID HEARTS COAT HANGER,586
SET OF 4 KNICK KNACK TINS LONDON ,586
SET OF 2 TEA TOWELS APPLE AND PEARS,584
HAPPY STENCIL CRAFT,584
DOORMAT WELCOME PUPPIES,582
COLOUR GLASS. STAR T-LIGHT HOLDER,582
DINOSAURS  WRITING SET ,582
SET 12 COLOUR PENCILS SPACEBOY ,580
CARD SUKI BIRTHDAY,580
BUNDLE OF 3 RETRO NOTE BOOKS,580
BIRD HOUSE HOT WATER BOTTLE,580
ROUND CAKE TIN VINTAGE RED,578
CARD CIRCUS PARADE,578
FELTCRAFT GIRL AMELIE KIT,576
FAMILY PHOTO FRAME CORNICE,574
WATERING CAN PINK BUNNY,574
12 PENCILS TALL TUBE RED RETROSPOT,574
GIRAFFE WOODEN RULER,574
HOME SWEET HOME METAL SIGN ,574
SET OF 4 ENGLISH ROSE COASTERS,574
BISCUIT TIN VINTAGE CHRISTMAS,572
PARISIENNE KEY CABINET ,570
VINTAGE LEAF MAGNETIC NOTEPAD,570
ANTIQUE GLASS DRESSING TABLE POT,570
TRAVEL CARD WALLET TRANSPORT,570
BATH BUILDING BLOCK WORD,570
15CM CHRISTMAS GLASS BALL 20 LIGHTS,570
RIBBON REEL SNOWY VILLAGE,566
CERAMIC CHERRY CAKE MONEY BANK,566
 SET 2 TEA TOWELS I LOVE LONDON ,564
LIPSTICK PEN RED,564
SET 2 TEA TOWELS I LOVE LONDON ,564
ICE CREAM SUNDAE LIP GLOSS,560
RECYCLED ACAPULCO MAT TURQUOISE,558
GLASS JAR DAISY FRESH COTTON WOOL,558
CALENDAR PAPER CUT DESIGN,558
QUEENS GUARD COFFEE MUG,558
ZINC T-LIGHT HOLDER STARS SMALL,556
TREASURE ISLAND BOOK BOX,556
PACK OF 12 WOODLAND TISSUES ,554
SWALLOWS GREETING CARD,554
PAPER BUNTING VINTAGE PAISLEY,552
FELTCRAFT DOLL EMILY,552
HEART DECORATION WITH PEARLS ,552
SMALL HANGING IVORY/RED WOOD BIRD,550
PARISIENNE JEWELLERY DRAWER ,550
SET OF 9 HEART SHAPED BALLOONS,550
NO JUNK MAIL METAL SIGN,550
ZINC WILLIE WINKIE  CANDLE STICK,548
CHRISTMAS STAR WISH LIST CHALKBOARD,548
COWBOYS AND INDIANS BIRTHDAY CARD ,548
TRAVEL CARD WALLET SUKI,546
COFFEE MUG APPLES DESIGN,546
BOX OF VINTAGE ALPHABET BLOCKS,544
SINGLE ANTIQUE ROSE HOOK IVORY,544
CHRISTMAS TOILET ROLL,542
RED METAL BOX TOP SECRET,542
CARD MOTORBIKE SANTA,542
FAIRY CAKE FLANNEL ASSORTED COLOUR,540
SMALL RED BABUSHKA NOTEBOOK ,540
"BIRTHDAY CARD, RETRO SPOT",540
COFFEE MUG CAT + BIRD DESIGN,540
36 PENCILS TUBE SKULLS,540
CHRISTMAS HANGING STAR WITH BELL,540
BULL DOG BOTTLE OPENER,540
PICTURE FRAME WOOD TRIPLE PORTRAIT,540
CARD PSYCHEDELIC APPLES,538
VINTAGE DOILY JUMBO BAG RED ,538
RIBBON REEL CHRISTMAS PRESENT ,538
SET3 BOOK BOX GREEN GINGHAM FLOWER ,538
TRADITIONAL NAUGHTS & CROSSES,536
VICTORIAN SEWING BOX MEDIUM,536
SILVER BELLS TABLE DECORATION,534
MAGIC DRAWING SLATE SPACEBOY ,534
RED RETROSPOT OVEN GLOVE DOUBLE,532
ROCKING HORSE RED CHRISTMAS ,532
PINK FLORAL FELTCRAFT SHOULDER BAG,532
PINK DOUGHNUT TRINKET POT ,532
12 PENCILS TALL TUBE SKULLS,532
12 MESSAGE CARDS WITH ENVELOPES,530
CHRISTMAS PUDDING TRINKET POT ,530
PINK HEART SHAPE EGG FRYING PAN,530
PENNY FARTHING BIRTHDAY CARD,530
PINK DRAWER KNOB ACRYLIC EDWARDIAN,528
RED RETROSPOT SUGAR JAM BOWL,528
KINGS CHOICE TEA CADDY ,524
DECORATIVE WICKER HEART LARGE,524
CHARLIE + LOLA RED HOT WATER BOTTLE,524
PARISIENNE CURIO CABINET,522
HEART FILIGREE DOVE LARGE,522
MEDIUM CERAMIC TOP STORAGE JAR,520
MINIATURE ANTIQUE ROSE HOOK IVORY,520
SET OF 5 LUCKY CAT MAGNETS ,520
STRAWBERRY   PICNIC BAG,518
ICE CREAM PEN LIP GLOSS ,518
OWL DOORSTOP,518
RED RETROSPOT BUTTER DISH,518
MAGNETS PACK OF 4 SWALLOWS,516
PHOTO FRAME 3 CLASSIC HANGING,514
VINTAGE DONKEY TAIL GAME ,514
12 PENCILS TALL TUBE WOODLAND,512
GLASS APOTHECARY BOTTLE PERFUME,512
SKETCHBOOK MAGNETIC SHOPPING LIST,512
SMALL PURPLE BABUSHKA NOTEBOOK ,512
TRIPLE HOOK ANTIQUE IVORY ROSE,512
BUTTON BOX ,512
PURPLE DRAWERKNOB ACRYLIC EDWARDIAN,512
SKULLS WRITING SET ,512
RETROSPOT WOODEN HEART DECORATION,510
SET 6 PAPER TABLE LANTERN STARS ,506
EMERGENCY FIRST AID TIN ,506
ADVENT CALENDAR GINGHAM SACK,506
BAG 250g SWIRLY MARBLES,504
SET OF 4 JAM JAR MAGNETS,504
RAIN PONCHO RETROSPOT,504
PANTRY ROLLING PIN,502
FOLKART ZINC HEART CHRISTMAS DEC,502
GLITTER BUTTERFLY CLIPS,500
SMALL CHOCOLATES PINK BOWL,500
HERB MARKER BASIL,500
WRAP ENGLISH ROSE ,500
CHILDS BREAKFAST SET SPACEBOY ,500
IVORY WICKER HEART MEDIUM,500
GIN & TONIC DIET GREETING CARD ,498
HERB MARKER ROSEMARY,498
CARD CHRISTMAS VILLAGE,498
TRAVEL CARD WALLET I LOVE LONDON,498
CHILDRENS CUTLERY POLKADOT GREEN ,498
SET/10 BLUE POLKADOT PARTY CANDLES,498
ENCHANTED BIRD COATHANGER 5 HOOK,496
RED RETROSPOT CHILDRENS UMBRELLA,496
HERB MARKER MINT,496
SCOTTIE DOGS BABY BIB,496
GARLAND WOODEN HAPPY EASTER,494
SET OF 36 DOILIES PANTRY DESIGN,494
BOYS VINTAGE TIN SEASIDE BUCKET,494
SMALL CERAMIC TOP STORAGE JAR ,494
GINGHAM HEART  DOORSTOP RED,494
HERB MARKER PARSLEY,494
GUMBALL MAGAZINE RACK,492
BUBBLEGUM RING ASSORTED,492
HERB MARKER THYME,492
BROCADE RING PURSE ,490
"FEATHER PEN,HOT PINK",488
ROUND CONTAINER SET OF 5 RETROSPOT,486
BOX OF VINTAGE JIGSAW BLOCKS ,486
S/6 WOODEN SKITTLES IN COTTON BAG,486
PAPER BUNTING COLOURED LACE,486
HOME SWEET HOME CUSHION COVER ,484
RED RETROSPOT TAPE,484
SPACEBOY MINI BACKPACK,482
SET 12 COLOUR PENCILS DOLLY GIRL ,482
KNEELING MAT HOUSEWORK  DESIGN,482
GLASS JAR ENGLISH CONFECTIONERY,482
3 TRADITIONAl BISCUIT CUTTERS  SET,480
GLASS  BEURRE DISH,480
HOME SWEET HOME HANGING HEART,480
FINE WICKER HEART ,480
MAGIC DRAWING SLATE DOLLY GIRL ,478
WRAP ALPHABET DESIGN,478
PACK OF 12 SKULL TISSUES,478
"METAL SIGN,CUPCAKE SINGLE HOOK",478
CHILDREN'S SPACEBOY MUG,478
ABC TREASURE BOOK BOX ,478
DOORMAT 3 SMILEY CATS,476
20 DOLLY PEGS RETROSPOT,474
SET OF 6 3D KIT CARDS FOR KIDS,474
ANTIQUE GLASS PEDESTAL BOWL,474
FUNKY DIVA PEN,474
POLKADOT RAIN HAT ,472
SET OF 3 BIRD LIGHT PINK FEATHER ,472
GLASS BON BON JAR,472
CARD PARTY GAMES ,472
TRAVEL CARD WALLET UNION JACK,470
TRIPLE PHOTO FRAME CORNICE ,470
RED BABY BUNTING ,470
HEART DECORATION PAINTED ZINC ,470
MINI CAKE STAND  HANGING STRAWBERY,468
APPLE BATH SPONGE,466
SET OF 5 PANCAKE DAY MAGNETS,466
CITRONELLA CANDLE GARDEN POT,466
POPPY'S PLAYHOUSE BATHROOM,466
MINI WOODEN HAPPY BIRTHDAY GARLAND,464
DECORATIVE WICKER HEART MEDIUM,464
GIRLS VINTAGE TIN SEASIDE BUCKET,464
STRAWBERRY BATH SPONGE ,464
RED METAL BEACH SPADE ,464
RIBBON REEL MAKING SNOWMEN ,464
ROMANTIC PINKS RIBBONS ,464
FANCY FONTS BIRTHDAY WRAP,464
AIRLINE BAG VINTAGE JET SET RED,464
WATERING CAN GREEN DINOSAUR,464
RETROSPOT CIGAR BOX MATCHES ,462
TRAVEL CARD WALLET PANTRY,462
LARGE CIRCULAR MIRROR MOBILE,462
SET OF 9 BLACK SKULL BALLOONS,462
SMALL RED RETROSPOT WINDMILL,462
PACK OF 6 SANDCASTLE FLAGS ASSORTED,462
SET 12 KIDS  WHITE CHALK STICKS,460
METAL SIGN EMPIRE TEA,460
STRAWBERRY FAIRY CAKE TEAPOT,460
HANGING HEART WITH BELL,458
JAZZ HEARTS ADDRESS BOOK,458
PACK OF 12 SPACEBOY TISSUES,456
PAINT YOUR OWN CANVAS SET,456
GLASS APOTHECARY BOTTLE TONIC,456
GROW YOUR OWN BASIL IN ENAMEL MUG,456
VINTAGE UNION JACK MEMOBOARD,456
TRAVEL CARD WALLET RETROSPOT,454
ANTIQUE SILVER TEA GLASS ETCHED,454
6 RIBBONS EMPIRE  ,454
CARD BIRTHDAY COWBOY,452
GLASS HEART T-LIGHT HOLDER ,452
DOORMAT AIRMAIL ,452
TREASURE TIN BUFFALO BILL ,452
HEART WOODEN CHRISTMAS DECORATION,452
BELLE JARDINIERE CUSHION COVER,450
FUNKY WASHING UP GLOVES ASSORTED,450
BLUE VINTAGE SPOT BEAKER,450
CARD I LOVE LONDON ,448
FRENCH BATHROOM SIGN BLUE METAL,448
ROUND CAKE TIN VINTAGE GREEN,448
SPACEBOY CHILDRENS CUP,448
BOX OF 6 CHRISTMAS CAKE DECORATIONS,448
PACK OF 12 COLOURED PENCILS,446
SET/6 COLLAGE PAPER PLATES,446
STAR WOODEN CHRISTMAS DECORATION,446
MINI LIGHTS WOODLAND MUSHROOMS,446
SET 3 PAPER VINTAGE CHICK PAPER EGG,446
WALL ART STOP FOR TEA ,446
FILIGRIS HEART WITH BUTTERFLY,444
FOOT STOOL HOME SWEET HOME ,444
HOLIDAY FUN LUDO,444
DISCO BALL CHRISTMAS DECORATION,444
CAKE PLATE LOVEBIRD WHITE,444
CHRISTMAS LIGHTS 10 VINTAGE BAUBLES,444
PLAYING CARDS JUBILEE UNION JACK,442
BLUE POLKADOT WRAP,440
VINTAGE CHRISTMAS GIFT SACK,440
SMALL YELLOW BABUSHKA NOTEBOOK ,440
PACK OF 12 PINK PAISLEY TISSUES ,438
SILVER STARS TABLE DECORATION,438
VINTAGE DOILY DELUXE SEWING KIT ,438
EMBOSSED GLASS TEALIGHT HOLDER,438
CHARLIE AND LOLA FIGURES TINS,438
GAOLERS KEYS DECORATIVE GARDEN ,438
OVEN MITT APPLES DESIGN,436
"KEY FOB , FRONT  DOOR ",436
PENS ASSORTED FUNNY FACE,436
ENGLISH ROSE GARDEN SECATEURS,436
MONSTERS STENCIL CRAFT,434
LIPSTICK PEN FUSCHIA,434
SET OF SALT AND PEPPER TOADSTOOLS,434
DINOSAUR LUNCH BOX WITH CUTLERY,434
SPACEBOY CHILDRENS BOWL,434
JINGLE BELL HEART ANTIQUE SILVER,434
COFFEE MUG PEARS  DESIGN,434
RAINY LADIES BIRTHDAY CARD,432
HERB MARKER CHIVES ,432
ROLL WRAP 50'S RED CHRISTMAS ,432
CHILDRENS DOLLY GIRL MUG,432
ZINC HERB GARDEN CONTAINER,432
ENAMEL WASH BOWL CREAM,432
GLASS APOTHECARY BOTTLE ELIXIR,432
GYMKHANA TREASURE BOOK BOX,430
PANTRY PASTRY BRUSH,430
VINTAGE KID DOLLY CARD ,430
HEADS AND TAILS SPORTING FUN,428
SET OF 5 MINI GROCERY MAGNETS,428
RED RETROSPOT TISSUE BOX,428
3 TIER CAKE TIN GREEN AND CREAM,428
BOX OF 6 ASSORTED COLOUR TEASPOONS,426
STORAGE TIN VINTAGE DOILY ,426
PINK POLKADOT WRAP ,426
CHILDS BREAKFAST SET CIRCUS PARADE,426
FRYING PAN UNION FLAG,426
FRENCH BLUE METAL DOOR SIGN 1,426
BOHEMIAN COLLAGE STATIONERY SET,426
3 DRAWER ANTIQUE WHITE WOOD CABINET,426
SET OF 6 T-LIGHTS SANTA,426
SET OF 2 WOODEN MARKET CRATES,424
ENAMEL WATERING CAN CREAM,424
SPACEBOY GIFT WRAP,424
DRAWER KNOB CRACKLE GLAZE IVORY,424
MAKE YOUR OWN FLOWERPOWER CARD KIT,422
UNION STRIPE WITH FRINGE  HAMMOCK,422
METAL SIGN DROP YOUR PANTS,422
REGENCY SUGAR TONGS,422
WHITE ROCKING HORSE HAND PAINTED,422
PACK OF SIX LED TEA LIGHTS,422
DOORMAT UNION JACK GUNS AND ROSES,420
DOORMAT TOPIARY,420
ANTIQUE TALL SWIRLGLASS TRINKET POT,420
BLACK KITCHEN SCALES,420
BOTTLE BAG RETROSPOT ,418
36 FOIL HEART CAKE CASES,418
HANGING METAL STAR LANTERN,418
GOLD MINI TAPE MEASURE ,418
TOOTHPASTE TUBE PEN,418
GREEN POLKADOT BOWL,418
FLUTED ANTIQUE CANDLE HOLDER,418
LUNCH BAG SUKI  DESIGN ,418
