index,ItemDescription
6 ROCKET BALLOONS ,414
CHRISTMAS RETROSPOT ANGEL WOOD,414
CHOCOLATE CALCULATOR,412
RECYCLED ACAPULCO MAT GREEN,412
6 RIBBONS ELEGANT CHRISTMAS ,412
GLITTER HANGING BUTTERFLY STRING,412
CERAMIC CAKE DESIGN SPOTTED MUG,412
MINI CAKE STAND WITH HANGING CAKES,412
BEADED CRYSTAL HEART PINK ON STICK,412
BUNDLE OF 3 SCHOOL EXERCISE BOOKS  ,410
IVORY GIANT GARDEN THERMOMETER,410
COFFEE MUG DOG + BALL DESIGN,410
TRAVEL CARD WALLET SKULLS,410
CHILDS BREAKFAST SET DOLLY GIRL ,408
DOORMAT MULTICOLOUR STRIPE,408
RED VINTAGE SPOT BEAKER,408
PICNIC BOXES SET OF 3 RETROSPOT ,406
ANTIQUE ALL GLASS CANDLESTICK,406
TRADTIONAL ALPHABET STAMP SET,406
CHRISTMAS GINGHAM STAR,406
WOOD STAMP SET FLOWERS,406
MAGIC DRAWING SLATE CIRCUS PARADE  ,406
6 RIBBONS SHIMMERING PINKS ,404
3 RAFFIA RIBBONS 50'S CHRISTMAS ,404
VINTAGE BILLBOARD LOVE/HATE MUG,404
DOORMAT BLACK FLOCK ,402
CLASSIC CHROME BICYCLE BELL ,402
RIBBON REEL LACE DESIGN ,402
3D TRADITIONAL CHRISTMAS STICKERS,402
BIG DOUGHNUT FRIDGE MAGNETS,402
ROSE COTTAGE KEEPSAKE BOX ,400
DOLLY GIRL CHILDRENS CUP,400
CHRISTMAS TREE STAR DECORATION,400
BLUE DRAWER KNOB ACRYLIC EDWARDIAN,400
TOADSTOOL MONEY BOX,400
SET/6 PURPLE BUTTERFLY T-LIGHTS,400
BLUE POLKADOT PLATE ,400
CHRISTMAS RETROSPOT STAR WOOD,400
S/4 PINK FLOWER CANDLES IN BOWL,400
SET OF 6 T-LIGHTS TOADSTOOLS,398
CHRISTMAS GINGHAM TREE,396
UNION JACK FLAG LUGGAGE TAG,394
HEART WREATH DECORATION WITH BELL,394
GREEN CHRISTMAS TREE CARD HOLDER,394
DRAWER KNOB CERAMIC IVORY,392
GREEN DRAWER KNOB ACRYLIC EDWARDIAN,392
DOLLY GIRL CHILDRENS BOWL,392
FRENCH BLUE METAL DOOR SIGN 2,392
PACK OF 6 SKULL PAPER PLATES,390
SET OF 4 KNICK KNACK TINS POPPIES,390
SET 12 COLOURING PENCILS DOILY,390
WOOD STAMP SET BEST WISHES,390
SET/4 RED MINI ROSE CANDLE IN BOWL,388
EASTER CRAFT 4 CHICKS ,388
SET OF 4 KNICK KNACK TINS DOILEY ,386
ALPHABET STENCIL CRAFT,386
WELCOME  WOODEN BLOCK LETTERS,386
PINK VINTAGE SPOT BEAKER,386
FRENCH TOILET SIGN BLUE METAL,386
POLYESTER FILLER PAD 40x40cm,386
BAKING MOULD HEART MILK CHOCOLATE,386
SET/6 PINK  BUTTERFLY T-LIGHTS,384
CERAMIC STRAWBERRY DESIGN MUG,384
KINGS CHOICE BISCUIT TIN,384
36 PENCILS TUBE WOODLAND,384
CUPCAKE LACE PAPER SET 6,384
SET 36 COLOUR PENCILS SPACEBOY ,384
BLACK HEART CARD HOLDER,382
PACK OF 12 PINK POLKADOT TISSUES,382
GREEN VINTAGE SPOT BEAKER,380
3D VINTAGE CHRISTMAS STICKERS ,380
TEA FOR ONE POLKADOT,380
ASSORTED BOTTLE TOP  MAGNETS ,378
SPACEBOY BEAKER,378
SPACEBOY CHILDRENS EGG CUP,378
STAR DECORATION PAINTED ZINC ,378
BLUE GIANT GARDEN THERMOMETER,378
HOT WATER BOTTLE BABUSHKA ,376
FELTCRAFT GIRL NICOLE KIT,376
PACK OF 12 50'S CHRISTMAS TISSUES,376
PIZZA PLATE IN BOX,376
RECYCLED ACAPULCO MAT RED,376
 SPACEBOY BABY GIFT SET,376
DECORATIVE CATS BATHROOM BOTTLE,376
UNION JACK FLAG PASSPORT COVER ,376
URBAN BLACK RIBBONS ,376
BUFFALO BILL TREASURE BOOK BOX,374
PACK 3 BOXES BIRD PANNETONE ,374
PINK  POLKADOT PLATE ,374
VICTORIAN  METAL POSTCARD SPRING,372
BOUDOIR SQUARE TISSUE BOX,372
OVERNIGHT BAG VINTAGE ROSE PAISLEY,372
VINTAGE  2 METER FOLDING RULER,372
SWEETHEART WIRE MAGAZINE RACK,372
GLASS JAR DIGESTIVE BISCUITS,372
ROCKING HORSE GREEN CHRISTMAS ,372
WOOD STOCKING CHRISTMAS SCANDISPOT,370
WOODLAND PARTY BAG + STICKER SET,370
SET/6 COLLAGE PAPER CUPS,370
DOORMAT RESPECTABLE HOUSE,368
CHRISTMAS TREE HEART DECORATION,368
MAN FLU METAL SIGN,368
NOVELTY BISCUITS CAKE STAND 3 TIER,366
HOME SWEET HOME BLACKBOARD,366
MUSICAL ZINC HEART DECORATION ,366
"FEATHER PEN,COAL BLACK",366
CHRISTMAS METAL TAGS ASSORTED ,366
3 TIER CAKE TIN RED AND CREAM,364
VICTORIAN SEWING BOX LARGE,364
DINOSAUR KEYRINGS ASSORTED,364
FAIRY CAKES NOTEBOOK A7 SIZE,364
PACK OF 6 PANNETONE GIFT BOXES,364
36 DOILIES VINTAGE CHRISTMAS,362
CARD HOLDER GINGHAM HEART,362
 DOLLY GIRL BEAKER,362
RED RETROSPOT TEA CUP AND SAUCER ,362
CHILDRENS TOY COOKING UTENSIL SET,362
VINTAGE BILLBOARD DRINK ME MUG,362
LARGE PURPLE BABUSHKA NOTEBOOK  ,362
MISTLETOE HEART WREATH GREEN,362
MINI JIGSAW SPACEBOY,360
CERAMIC CAKE STAND + HANGING CAKES,360
MOODY GIRL DOOR HANGER ,360
PHARMACIE FIRST AID TIN,360
12 PENCILS TALL TUBE POSY,360
TRAVEL CARD WALLET FLOWER MEADOW,358
CHRISTMAS RETROSPOT TREE WOOD,358
WALL ART BICYCLE SAFETY,358
SWALLOW WOODEN CHRISTMAS DECORATION,358
WOOD STAMP SET HAPPY BIRTHDAY,358
COTTON APRON PANTRY DESIGN,358
MAKE YOUR OWN MONSOON CARD KIT,356
LE JARDIN BOTANIQUE CUSHION COVER,356
PACK OF 6 SKULL PAPER CUPS,356
SAVE THE PLANET COTTON TOTE BAG,354
WHITE JEWELLED HEART DECORATION,354
BISCUIT TIN VINTAGE RED,354
WRAP RED APPLES ,354
SKULLS  WATER TRANSFER TATTOOS ,352
SMALL HEART FLOWERS HOOK ,352
REGENCY TEA STRAINER,352
PACK OF 12 STICKY BUNNIES,352
EDWARDIAN PARASOL PINK,352
MAGIC DRAWING SLATE DINOSAUR,350
PINK OWL SOFT TOY,350
200 RED + WHITE BENDY STRAWS,350
SET 12 COLOUR PENCILS LOVE LONDON,350
BISCUITS SMALL BOWL LIGHT BLUE,348
VINTAGE UNION JACK APRON,348
SET 10 NIGHT OWL LIGHTS,348
3 ROSE MORRIS BOXED CANDLES,348
RED GINGHAM TEDDY BEAR ,348
SET OF 6 NATIVITY MAGNETS ,346
HEART SHAPED HOLLY WREATH,346
SEWING SUSAN 21 NEEDLE SET,346
AIRLINE BAG VINTAGE JET SET BROWN,346
EMPIRE TISSUE BOX,346
S/4 IVORY MINI ROSE CANDLE IN BOWL,346
CARD CAT AND TREE ,344
FRENCH KITCHEN SIGN BLUE METAL,344
SET/3 VANILLA SCENTED CANDLE IN BOX,344
ASS FLORAL PRINT MULTI SCREWDRIVER,344
ANGEL DECORATION 3 BUTTONS ,344
SET OF 4 ROSE BOTANICAL CANDLES,344
BEADED CRYSTAL HEART GREEN ON STICK,344
CAMOUFLAGE LED TORCH,342
SET/6 TURQUOISE BUTTERFLY T-LIGHTS,342
SET OF 6 T-LIGHTS SNOWMEN,342
RETRO COFFEE MUGS ASSORTED,342
POLKADOT PEN,340
3 HOOK HANGER MAGIC GARDEN,340
GENTLEMAN SHIRT REPAIR KIT ,340
DAIRY MAID LARGE MILK JUG,340
FIRST AID TIN,340
I CAN ONLY PLEASE ONE PERSON MUG,340
SWEETHEART 3 TIER CAKE STAND ,340
RECYCLED PENCIL WITH RABBIT ERASER,340
FRENCH BLUE METAL DOOR SIGN 3,340
ENAMEL COLANDER CREAM,340
12 COLOURED PARTY BALLOONS,340
ZINC T-LIGHT HOLDER STAR LARGE,340
RED RETROSPOT TRADITIONAL TEAPOT ,340
PACK 3 BOXES CHRISTMAS PANNETONE,338
FRYING PAN RED RETROSPOT,338
RED RETROSPOT MUG,338
SET/4 SKULL BADGES,338
DOLLY GIRL MINI BACKPACK,338
MOUSE TOY WITH PINK T-SHIRT,336
RETROSPOT LAMP,336
STRAWBERRY RAFFIA FOOD COVER,336
4 VANILLA BOTANICAL CANDLES,336
PINK PARTY BAGS,336
MOTORING TISSUE BOX,336
WHITE LOVEBIRD LANTERN,336
CHARLIE+LOLA RED HOT WATER BOTTLE ,336
"ELEPHANT, BIRTHDAY CARD, ",336
CITRONELLA CANDLE FLOWERPOT,334
MINI LADLE LOVE HEART PINK,334
FRENCH BLUE METAL DOOR SIGN No,334
WRAP PINK FAIRY CAKES ,334
EASTER TIN BUNNY BOUQUET,334
SET 40 HEART SHAPE PETIT FOUR CASES,334
SKULLS AND CROSSBONES WRAP,332
SWALLOW SQUARE TISSUE BOX,332
RECYCLED ACAPULCO MAT PINK,332
CREAM SWEETHEART EGG HOLDER,332
SLATE TILE NATURAL HANGING,332
CHRISTMAS LIGHTS 10 SANTAS ,332
ROSE CARAVAN DOORSTOP,332
GLASS CLOCHE SMALL,332
TOY TIDY DOLLY GIRL DESIGN,330
CARD GINGHAM ROSE ,330
MINT DINER WALL CLOCK,330
TOXIC AREA  DOOR HANGER ,330
IVORY SWEETHEART WIRE LETTER RACK ,330
CARAVAN SQUARE TISSUE BOX,330
LARGE RED BABUSHKA NOTEBOOK ,330
BAKING MOULD CHOCOLATE CUPCAKES,330
RED ROCKING HORSE HAND PAINTED,330
FELTCRAFT HAIRBAND RED AND BLUE,330
S/4 CACTI CANDLES,328
FRENCH BLUE METAL DOOR SIGN 5,328
DECORATIVE ROSE BATHROOM BOTTLE,328
RECYCLED ACAPULCO MAT BLUE,328
PEARL CRYSTAL PUMPKIN T-LIGHT HLDR,328
WRAP DOILEY DESIGN,328
SET OF 2 CHRISTMAS DECOUPAGE CANDLE,328
DRAWER KNOB CRACKLE GLAZE PINK,328
FELTCRAFT HAIRBAND PINK AND BLUE,328
BALLOON WATER BOMB PACK OF 35,326
SET OF 6 FUNKY BEAKERS,326
SET/4 WHITE RETRO STORAGE CUBES ,326
GREEN ROSE WASHBAG,326
DRAWER KNOB CRACKLE GLAZE GREEN,324
LARGE CAKE STAND  HANGING STRAWBERY,324
CHILDRENS CUTLERY CIRCUS PARADE,324
 OVAL WALL MIRROR DIAMANTE ,324
BANQUET BIRTHDAY  CARD  ,324
SILVER HEARTS TABLE DECORATION,324
MAGIC DRAWING SLATE PURDEY,324
PACK OF 12 VINTAGE CHRISTMAS TISSUE,322
MORE BUTTER METAL SIGN ,322
FRENCH BLUE METAL DOOR SIGN 4,322
CREAM WALL PLANTER HEART SHAPED,322
RIBBON REEL POLKADOTS ,322
ENVELOPE 50 BLOSSOM IMAGES,320
SET/10 IVORY POLKADOT PARTY CANDLES,320
WOODEN OWLS LIGHT GARLAND ,320
MAGNETS PACK OF 4 HOME SWEET HOME,320
WRAP POPPIES  DESIGN,320
RETROSPOT SMALL TUBE MATCHES,320
BLUE COAT RACK PARIS FASHION,320
COSY HOUR CIGAR BOX MATCHES ,318
RETRO MOD TRAY,318
RED HEART SHAPE LOVE BUCKET ,318
FAIRY CAKES NOTEBOOK A6 SIZE,318
PENS ASSORTED SPACEBALL,318
SET OF 6 HEART CHOPSTICKS,318
check,318
JUNGLE POPSICLES ICE LOLLY MOULDS,316
CINAMMON SET OF 9 T-LIGHTS,316
SMALL IVORY HEART WALL ORGANISER,316
6 EGG HOUSE PAINTED WOOD,316
JIGSAW TREE WITH BIRDHOUSE,316
MAGNETS PACK OF 4 VINTAGE COLLAGE,316
WICKER WREATH LARGE,316
DECORATION WHITE CHICK MAGIC GARDEN,314
STAR WREATH DECORATION WITH BELL,314
LADS ONLY TISSUE BOX,314
MINI PLAYING CARDS SPACEBOY ,312
LARGE IVORY HEART WALL ORGANISER,312
VINTAGE  2 METRE FOLDING RULER,312
VINTAGE CREAM 3 BASKET CAKE STAND,312
SET OF 6 CAKE CHOPSTICKS,312
RED RETROSPOT PURSE ,312
FELTCRAFT HAIRBAND PINK AND PURPLE,312
PACK OF 12 BLUE PAISLEY TISSUES ,312
GREEN GIANT GARDEN THERMOMETER,310
PARISIENNE SEWING BOX,310
SET 36 COLOURING PENCILS DOILY,310
FOLDING BUTTERFLY MIRROR HOT PINK ,310
GLITTER HEART DECORATION,310
MINI LADLE LOVE HEART RED ,310
POSTE FRANCE CUSHION COVER,310
RED LOVE HEART SHAPE CUP,310
BABUSHKA LIGHTS STRING OF 10,310
WOODLAND MINI BACKPACK,310
VINTAGE BELLS GARLAND,310
VINTAGE GLASS T-LIGHT HOLDER,308
KINGS CHOICE MUG,308
SET 36 COLOUR PENCILS DOLLY GIRL,308
REINDEER HEART DECORATION SILVER,308
SKULLS PARTY BAG + STICKER SET,308
RED STAR CARD HOLDER,308
PACK OF 6 LARGE FRUIT STRAWS ,308
WOODEN SKITTLES GARDEN SET,306
TOAST ITS - FAIRY FLOWER,306
VINTAGE CHRISTMAS CAKE FRILL,306
"FEATHER PEN,LIGHT PINK",306
BLUE POLKADOT WASHING UP GLOVES,304
SET OF 4 NAPKIN CHARMS HEARTS,304
WRAP 50'S  CHRISTMAS,304
METAL SIGN NEIGHBOURHOOD WITCH ,304
STAR DECORATION RUSTIC,304
AIRLINE BAG VINTAGE WORLD CHAMPION ,304
CIRCUS PARADE CHILDRENS EGG CUP ,302
KNICKERBOCKERGLORY MAGNET ASSORTED ,302
GARAGE KEY FOB,302
CHILDREN'S CIRCUS PARADE MUG,302
OFFICE MUG WARMER BLACK+SILVER ,302
WALL ART CLASSIC PUDDINGS ,302
WOODEN REGATTA BUNTING,302
CERAMIC CAKE BOWL + HANGING CAKES,302
DOORMAT MERRY CHRISTMAS RED ,300
12 IVORY ROSE PEG PLACE SETTINGS,300
DECORATION  BUTTERFLY  MAGIC GARDEN,300
CRAZY DAISY HEART DECORATION,300
VINTAGE SEASIDE JIGSAW PUZZLES,300
FELTCRAFT HAIRBANDS PINK AND WHITE ,300
BLACK PIRATE TREASURE CHEST,298
SANDALWOOD FAN,298
GLAMOROUS  MUG,298
METAL SIGN HIS DINNER IS SERVED,298
FOOD COVER WITH BEADS SET 2 ,298
6 CHOCOLATE LOVE HEART T-LIGHTS,298
BUNNY WOODEN PAINTED WITH BIRD ,298
EMPIRE BIRTHDAY CARD,298
MEASURING TAPE BABUSHKA PINK,296
MILK PAN RED RETROSPOT,296
PETIT TRAY CHIC,296
PACK OF 20 SPACEBOY NAPKINS,296
JUMBO BAG SCANDINAVIAN PAISLEY,296
MINI CAKE STAND T-LIGHT HOLDER,296
CACTI T-LIGHT CANDLES,296
CERAMIC PIRATE CHEST MONEY BANK,296
BROWN  PIRATE TREASURE CHEST ,296
CHARLIE LOLA BLUE HOT WATER BOTTLE ,296
"DIAMANTE HEART SHAPED WALL MIRROR, ",296
GIRLS ALPHABET IRON ON PATCHES ,296
VICTORIAN SEWING KIT,294
VINTAGE RED ENAMEL TRIM JUG ,292
METAL DECORATION NAUGHTY CHILDREN ,292
SILK PURSE BABUSHKA PINK,292
RED DRAWER KNOB ACRYLIC EDWARDIAN,292
LOVE HEART TRINKET POT,292
FRENCH LAUNDRY SIGN BLUE METAL,292
FELT EGG COSY CHICKEN,292
SMALL PARISIENNE HEART PHOTO FRAME ,292
WOODEN ADVENT CALENDAR CREAM,292
BAG 500g SWIRLY MARBLES,292
PENS ASSORTED FUNKY JEWELED ,292
TEA TIME KITCHEN APRON,292
DARK BIRD HOUSE TREE DECORATION,290
SET OF 6 STRAWBERRY CHOPSTICKS,290
FIVE HEART HANGING DECORATION,290
3D CHRISTMAS STAMPS STICKERS ,290
WRAP CHRISTMAS VILLAGE,290
LARGE ANTIQUE WHITE PHOTO FRAME,290
SET OF 12  VINTAGE POSTCARD SET,290
CURIOUS IMAGES GIFT WRAP SET,288
LAVENDER SCENTED FABRIC HEART,288
T-LIGHT HOLDER SWEETHEART HANGING,288
DOORMAT VINTAGE LEAF,288
POLYESTER FILLER PAD 45x45cm,288
MIRRORED DISCO BALL ,288
GLASS JAR PEACOCK BATH SALTS,288
HEART CALCULATOR,286
LARGE RED RETROSPOT WINDMILL,286
FANNY'S REST STOPMETAL SIGN,286
FLOWER VINE RAFFIA FOOD COVER,286
CARRIAGE,286
BIRDHOUSE DECORATION MAGIC GARDEN,286
SET 3 SONG BIRD PAPER EGGS ASSORTED,286
SKULL DESIGN TV DINNER TRAY,286
SET OF 12 FORK CANDLES,286
4 PEAR BOTANICAL DINNER CANDLES,284
4 IVORY DINNER CANDLES SILVER FLOCK,284
EASTER TIN KEEPSAKE,284
PAPER POCKET TRAVELING FAN ,284
LIGHT GARLAND BUTTERFILES PINK,284
FRYING PAN PINK POLKADOT,284
RIBBON REEL FLORA + FAUNA ,282
RIBBON REEL SOCKS AND MITTENS,282
PACK OF 12 PAISLEY PARK TISSUES ,282
GIFT BAG PSYCHEDELIC APPLES,282
MINI JIGSAW DOLLY GIRL,282
WOODEN ADVENT CALENDAR RED,282
GLASS STAR FROSTED T-LIGHT HOLDER,282
BIRDHOUSE GARDEN MARKER ,282
ANGEL DECORATION STARS ON DRESS,282
36 FOIL STAR CAKE CASES ,280
BIRD DECORATION GREEN POLKADOT,280
PARTY CHARMS 50 PIECES,280
PAINTED PINK RABBIT ,280
ASSORTED TUTTI FRUTTI BRACELET,280
TOTE BAG I LOVE LONDON,280
DECORATIVE FLORE BATHROOM BOTTLE,280
WRAP VINTAGE LEAF DESIGN,280
RED RETROSPOT APRON ,280
LETTER HOLDER HOME SWEET HOME,278
4 LAVENDER BOTANICAL DINNER CANDLES,278
BROWN CHECK CAT DOORSTOP ,278
DRAWER KNOB CRACKLE GLAZE BLUE,278
DOLLY GIRL BABY GIFT SET,278
"KEY FOB , GARAGE DESIGN",278
SET OF 2 TRAYS HOME SWEET HOME,278
GREEN METAL BOX ARMY SUPPLIES,278
OFFICE MUG WARMER POLKADOT,278
RETROSPOT GIANT TUBE MATCHES,278
HEN HOUSE DECORATION,276
DOLLY GIRL CHILDRENS EGG CUP,276
CHILDS GARDEN FORK PINK,276
MULTICOLOUR SPRING FLOWER MUG,276
BREAD BIN DINER STYLE MINT,276
SKULLS  STICKERS,276
MAGIC DRAWING SLATE BUNNIES ,276
PACK OF 12 DOLLY GIRL TISSUES,276
VINTAGE CARAVAN GREETING CARD ,276
ROSE 3 WICK MORRIS BOX CANDLE,276
CARDHOLDER HOLLY WREATH METAL,274
DO NOT TOUCH MY STUFF DOOR HANGER ,274
OFFICE MUG WARMER CHOC+BLUE,274
FRENCH BLUE METAL DOOR SIGN 6,274
IVORY HANGING DECORATION  BIRD,274
BREAD BIN DINER STYLE PINK,274
GINGHAM RECIPE BOOK BOX,274
CHERRY BLOSSOM  DECORATIVE FLASK,274
LARGE CAKE TOWEL PINK SPOTS,274
5 HOOK HANGER RED MAGIC TOADSTOOL,274
PENCIL CASE LIFE IS BEAUTIFUL,274
BISCUIT TIN VINTAGE GREEN,274
NOEL WOODEN BLOCK LETTERS ,272
HOME SMALL WOOD LETTERS,272
KITTY PENCIL ERASERS,272
PIN CUSHION BABUSHKA PINK,272
ROMANTIC IMAGES GIFT WRAP SET,272
FOLKART STAR CHRISTMAS DECORATIONS,272
PARTY TIME PENCIL ERASERS,272
IVORY WICKER HEART SMALL,272
FOLDING BUTTERFLY MIRROR IVORY ,270
GLITTER CHRISTMAS STAR ,270
MAGNETS PACK OF 4 RETRO PHOTO,270
WRAP SUKI AND FRIENDS,270
FAIRY CAKE DESIGN UMBRELLA,270
DOG BOWL CHASING BALL DESIGN,270
RED POLKADOT BEAKER ,270
FRENCH GARDEN SIGN BLUE METAL,270
SPACEBOY TV DINNER TRAY,270
SKULL AND CROSSBONES  GARLAND ,268
RED SPOT PAPER GIFT BAG,268
BLOSSOM IMAGES GIFT WRAP SET,268
LUNCH BAG RED VINTAGE DOILY,268
BIRD DECORATION RED RETROSPOT,268
STRAWBERRY CERAMIC TRINKET POT,268
POCKET BAG BLUE PAISLEY RED SPOT,268
SET OF 2 CERAMIC PAINTED HEARTS ,268
CHILDS GARDEN FORK BLUE ,268
PINK UNION JACK  LUGGAGE TAG,268
STARS GIFT TAPE ,268
POTTING SHED SEED ENVELOPES,268
VINTAGE BEAD PINK PURSE ,268
PINK LOVE HEART SHAPE CUP,266
ALUMINIUM STAMPED HEART,266
RED CHARLIE+LOLA PERSONAL DOORSIGN,266
HANGING WOOD AND FELT BUTTERFLY ,266
CERAMIC BOWL WITH STRAWBERRY DESIGN,266
MINI PLAYING CARDS DOLLY GIRL ,266
RING OF ROSES BIRTHDAY CARD,266
S/4 VALENTINE DECOUPAGE HEART BOX,264
BAKING MOULD HEART WHITE CHOCOLATE,264
FELTCRAFT BOY JEAN-PAUL KIT,264
SET OF 4 KNICK KNACK TINS LEAF,264
BASKET OF TOADSTOOLS,264
RECYCLED ACAPULCO MAT LAVENDER,264
SET/4 SPRING FLOWER DECORATION,264
CARD DOG AND BALL ,262
MOROCCAN TEA GLASS,262
NOEL GARLAND PAINTED ZINC ,262
CAKE STAND VICTORIAN FILIGREE MED,262
FRENCH ENAMEL WATER BASIN,262
GREEN POLKADOT PLATE ,262
SNOWFLAKE PORTABLE TABLE LIGHT ,262
SET OF 4 NAPKIN CHARMS CUTLERY,262
BLACK TEA TOWEL CLASSIC DESIGN,262
HOME GARLAND PAINTED ZINC ,260
FRENCH BLUE METAL DOOR SIGN 8,260
BALLOON PUMP WITH 10 BALLOONS,260
 50'S CHRISTMAS GIFT BAG LARGE,260
CARD WEDDING DAY,260
WOODLAND DESIGN  COTTON TOTE BAG,260
LIPSTICK PEN BABY PINK,258
SET 36 COLOUR PENCILS LOVE LONDON,258
MINI PLAYING CARDS BUFFALO BILL ,258
HANGING CHICK GREEN DECORATION,258
WATERING CAN GARDEN MARKER,258
IVORY PAPER CUP CAKE CASES ,256
DOILEY STORAGE TIN,256
MAGNETS PACK OF 4 VINTAGE LABELS ,256
HANGING CHICK CREAM DECORATION,256
PARTY INVITES WOODLAND,256
SET OF 6 GIRLS CELEBRATION CANDLES,256
EMPIRE UNION JACK TV DINNER TRAY,256
CARROT CHARLIE+LOLA COASTER SET,256
WOODLAND BUNNIES LOLLY MAKERS,254
TOAST ITS - I LOVE YOU ,254
FILIGREE HEART BIRD WHITE ,254
EGG CUP NATURAL CHICKEN,254
PINK PAISLEY SQUARE TISSUE BOX ,254
DOG BOWL VINTAGE CREAM,254
AIRLINE BAG VINTAGE JET SET WHITE,252
ASSORTED COLOUR T-LIGHT HOLDER,252
CANDY SPOT CUSHION COVER,252
HEART STRING MEMO HOLDER HANGING,252
STAR T-LIGHT HOLDER WILLIE WINKIE,252
PINK  HEART SHAPE LOVE BUCKET ,252
MINI PLAYING CARDS GYMKHANA,252
CHRISTMAS TREE DECORATION WITH BELL,252
CAKE STAND VICTORIAN FILIGREE SMALL,252
PINK 3 PIECE POLKADOT CUTLERY SET,250
3 WHITE CHOC MORRIS BOXED CANDLES,250
MOODY BOY  DOOR HANGER ,250
CHRISTMAS MUSICAL ZINC STAR,250
ILLUSTRATED CAT BOWL ,250
BAKING MOULD EASTER EGG MILK CHOC,250
VINTAGE RED ENAMEL TRIM MUG ,250
WICKER WREATH SMALL,250
SET 10 LIGHTS NIGHT OWL,250
BLUE SAVANNAH PICNIC HAMPER FOR 2,248
SOFT PINK ROSE TOWEL ,248
SCANDINAVIAN 3 HEARTS NAPKIN RING,248
DAIRY MAID TRADITIONAL TEAPOT ,248
BICYCLE PUNCTURE REPAIR KIT ,248
PING MICROWAVE APRON,248
LOVE HEART POCKET WARMER,246
TEA COSY RED  STRIPE,246
TABLECLOTH RED APPLES DESIGN ,246
PINK CAT BOWL,246
CHRISTMAS HANGING TREE WITH BELL,246
TRAVEL CARD WALLET VINTAGE LEAF,246
RED 3 PIECE RETROSPOT CUTLERY SET,246
IF YOU CAN'T STAND THE HEAT MUG,246
SMALL RED RETROSPOT MUG IN BOX ,246
SWISS CHALET TREE DECORATION ,246
WHITE BROCANTE SOAP DISH,246
PACK OF 12 VINTAGE DOILY TISSUES,246
LARGE YELLOW BABUSHKA NOTEBOOK ,246
DOORMAT WELCOME SUNRISE,246
PINK DINER WALL CLOCK,244
FRENCH BLUE METAL DOOR SIGN 7,244
PLAYING CARDS I LOVE LONDON ,244
BEADED PEARL HEART WHITE ON STICK,244
PAINTED METAL STAR WITH HOLLY BELLS,244
FRENCH ENAMEL POT W LID,242
VINTAGE CHRISTMAS TABLECLOTH,242
CHARLIE + LOLA BISCUITS TINS,242
WRAP PAISLEY PARK ,242
PINK DOG BOWL,242
SPOTTY PINK DUCK DOORSTOP,242
FOLDING UMBRELLA RED/WHITE POLKADOT,242
PAINTED YELLOW WOODEN DAISY,242
SET OF 3 BLACK FLYING DUCKS,242
CERAMIC CAKE DESIGN SPOTTED PLATE,242
BLUE OWL SOFT TOY,240
HEARTS  STICKERS,240
BLUE PARTY BAGS ,240
ASSTD DESIGN RACING CAR PEN,240
PACK OF 6 COCKTAIL PARASOL STRAWS,240
CUPBOARD 3 DRAWER MA CAMPAGNE,238
CHILDS GARDEN TROWEL BLUE ,238
STORAGE TIN VINTAGE LEAF,238
HANGING CHICK  YELLOW DECORATION,238
SET/3 ROSE CANDLE IN JEWELLED BOX,238
SILVER MUG BONE CHINA TREE OF LIFE,238
CHARLIE & LOLA WASTEPAPER BIN FLORA,238
SET/3 OCEAN SCENT CANDLE JEWEL BOX,238
WOODLAND  HEIGHT CHART STICKERS ,238
ENGLISH ROSE SPIRIT LEVEL ,238
FILIGREE HEART BUTTERFLY WHITE ,238
SPACEBOY ROCKET LOLLY MAKERS,238
YELLOW GIANT GARDEN THERMOMETER,238
CERAMIC STRAWBERRY MONEY BOX,236
FAIRY TALE COTTAGE NIGHT LIGHT,236
BLUE CALCULATOR RULER,236
VINYL RECORD FRAME SILVER,236
ENAMEL FIRE BUCKET CREAM,236
HANGING HEN ON NEST DECORATION,236
BUNNY DECORATION MAGIC GARDEN,236
STOOL HOME SWEET HOME ,236
CAT BOWL VINTAGE CREAM,234
FELT EGG COSY WHITE RABBIT ,234
MAGIC SHEEP WOOL GROWING FROM PAPER,234
WALL ART DOG LICENCE ,234
ENGLISH ROSE SCENTED HANGING FLOWER,234
VINTAGE EMBOSSED HEART,234
CREAM FELT EASTER EGG BASKET,234
HEART T-LIGHT HOLDER WILLIE WINKIE,234
HOT BATHS SOAP HOLDER,234
LOCAL CAFE MUG,234
12 RED ROSE PEG PLACE SETTINGS,232
TEA TIME TEAPOT IN GIFT BOX,232
CHRISTMAS METAL POSTCARD WITH BELLS,232
HANGING WOOD AND FELT HEART,232
VINTAGE RED TRIM ENAMEL BOWL ,232
POTTING SHED TWINE,232
3D SHEET OF DOG STICKERS,232
SKULLS GREETING CARD,232
KEY RING BASEBALL BOOT UNION JACK,232
PACK OF 6 HANDBAG GIFT BOXES,230
PARTY CONE CHRISTMAS DECORATION ,230
GARLAND WITH STARS AND BELLS,230
BLUE CHARLIE+LOLA PERSONAL DOORSIGN,230
SET 12 VINTAGE DOILY CHALK ,230
TOADSTOOL BEDSIDE LIGHT ,230
PACK OF 6 SMALL FRUIT STRAWS,230
TV DINNER TRAY VINTAGE PAISLEY,228
DECORATION  PINK CHICK MAGIC GARDEN,228
DECORATIVE WICKER HEART SMALL,228
MISTLETOE HEART WREATH CREAM,228
CIRCUS PARADE BABY GIFT SET,228
GUMBALL MONOCHROME COAT RACK,228
RED COAT RACK PARIS FASHION,228
WALL ART BIG LOVE ,228
SOAP DISH BROCANTE,228
TEA TIME DES TEA COSY,228
HOME SWEET HOME KEY HOLDER,228
PEACE WOODEN BLOCK LETTERS,228
STRIPEY CHOCOLATE NESTING BOXES,226
FRENCH LAVENDER SCENT HEART,226
SWEETHEART WIRE WALL TIDY,226
VANILLA SCENT CANDLE JEWELLED BOX,226
BRIGHT BLUES RIBBONS ,226
POLKADOT COFFEE CUP & SAUCER PINK,226
COSY SLIPPER SHOES SMALL GREEN,226
METAL SIGN CUPCAKE SINGLE HOOK,226
DAIRY MAID TOASTRACK,226
RED ENCHANTED FOREST PLACEMAT,226
JIGSAW RABBIT AND BIRDHOUSE,226
BLACK MINI TAPE MEASURE ,226
HI TEC ALPINE HAND WARMER,226
EASTER TIN CHICKS PINK DAISY,226
CALENDAR IN SEASON DESIGN,224
RED FLOWER CROCHET FOOD COVER,224
KEY CABINET MA CAMPAGNE,224
TV DINNER TRAY DOLLY GIRL,224
STRAWBERRY HONEYCOMB  GARLAND ,224
RED REFECTORY CLOCK ,224
PLACE SETTING WHITE STAR,224
SET 8 CANDLES VINTAGE DOILY,224
VINTAGE UNION JACK CUSHION COVER,224
BUTTERFLIES STICKERS,224
SET OF 4 SANTA PLACE SETTINGS,224
"ASSORTED FLOWER COLOUR ""LEIS""",222
IVORY KNITTED MUG COSY ,222
SET OF 10 LANTERNS FAIRY LIGHT STAR,222
CHILDS GARDEN TROWEL PINK,222
PANTRY APPLE CORER,222
SALLE DE BAIN HOOK,222
FRENCH BLUE METAL DOOR SIGN 9,220
SET OF 6 T-LIGHTS CACTI ,220
MA CAMPAGNE CUTLERY BOX,220
EGG FRYING PAN RED ,220
PINK UNION JACK  PASSPORT COVER ,220
ASSORTED TUTTI FRUTTI PEN,220
RED RETROSPOT LUGGAGE TAG,218
LARGE CAKE TOWEL CHOCOLATE SPOTS,218
VINTAGE BILLBOARD MUG ,218
DISCO BALL ROTATOR BATTERY OPERATED,218
TRAVEL CARD WALLET RETRO PETALS,218
SHELF WITH 4 HOOKS HOME SWEET HOME,218
SET 6 FOOTBALL CELEBRATION CANDLES,218
EMPIRE GIFT WRAP,218
TOAST ITS - HAPPY BIRTHDAY,218
SWEETHEART BIRD HOUSE,216
BLUE/CREAM STRIPE CUSHION COVER ,216
BLUE 3 PIECE POLKADOT CUTLERY SET,216
CLASSIC FRENCH STYLE BASKET NATURAL,216
FELT EGG COSY BLUE RABBIT ,216
JINGLE BELL HEART ANTIQUE GOLD,216
TOOL BOX SOFT TOY ,216
JIGSAW TREE WITH WATERING CAN,216
ROUND STORAGE TIN VINTAGE LEAF,216
GLITTER CHRISTMAS TREE WITH BELLS,216
VINTAGE CHRISTMAS GIFT BAG LARGE ,214
MAGIC TREE -PAPER FLOWERS,214
BOOM BOX SPEAKER BOYS,214
KEY RING BASEBALL BOOT ASSORTED ,214
RETRO LONGBOARD IRONING BOARD COVER,214
FRIDGE MAGNETS US DINER ASSORTED,214
TV DINNER TRAY AIR HOSTESS ,214
HANGING WOOD AND FELT FLOWER,214
DANISH ROSE PHOTO FRAME,214
4 LILY  BOTANICAL DINNER CANDLES,212
CLASSIC BICYCLE CLIPS ,212
CHERRY CROCHET FOOD COVER,212
VINTAGE UNION JACK PENNANT,212
REINDEER HEART DECORATION GOLD,212
STRAWBERRIES  DESIGN FLANNEL ,212
WRAP I LOVE LONDON ,212
WRAP VINTAGE PETALS  DESIGN,212
"CHARLIE+LOLA""EXTREMELY BUSY"" SIGN",212
BOX OF 9 PEBBLE CANDLES,212
CHRISTMAS TABLE SILVER CANDLE SPIKE,212
WRAP CIRCUS PARADE,212
SET OF 16 VINTAGE PISTACHIO CUTLERY,212
BLUE EGG  SPOON,212
50'S CHRISTMAS PAPER GIFT BAG,210
PORCELAIN T-LIGHT HOLDERS ASSORTED,210
SET/6 FRUIT SALAD  PAPER PLATES,210
TEA COSY BLUE STRIPE,210
PACK OF 6 SWEETIE GIFT BOXES,210
FRENCH BLUE METAL DOOR SIGN 0,210
TROPICAL  HONEYCOMB PAPER GARLAND ,210
FRENCH PAISLEY CUSHION COVER ,210
HOT WATER BOTTLE SEX BOMB,210
MAKE YOUR OWN PLAYTIME CARD KIT,210
CHILDS GARDEN SPADE BLUE,210
ANT WHITE WIRE HEART SPIRAL,210
SET OF 16 VINTAGE ROSE CUTLERY,210
ASSORTED CREEPY CRAWLIES,210
 RED SPOT GIFT BAG LARGE,210
PAINTED METAL HEART WITH HOLLY BELL,210
SET OF 72 SKULL PAPER  DOILIES,210
FAIRY CAKE BIRTHDAY CANDLE SET,208
BALLOON ART MAKE YOUR OWN FLOWERS,208
RATTLE SNAKE EGGS,208
BUNNY WOODEN PAINTED WITH FLOWER ,208
PINK PAPER PARASOL ,208
SKULLS DESIGN FLANNEL,208
SET/6 FRUIT SALAD PAPER CUPS,208
ICE CREAM BUBBLES,208
PACK OF 12 CIRCUS PARADE TISSUES ,208
PINK DIAMANTE PEN IN GIFT BOX,208
GARLAND WITH HEARTS AND BELLS,208
FOLKART CLIP ON STARS,206
T-LIGHT HOLDER HANGING LOVE BIRD,206
CAKE STAND WHITE TWO TIER LACE,206
I LOVE LONDON BABY GIFT SET,206
YELLOW COAT RACK PARIS FASHION,206
WOODLAND  STICKERS,206
MINI JIGSAW DINOSAUR ,206
EMBROIDERED RIBBON REEL EMILY ,204
SET/6 PINK BIRD T-LIGHT CANDLES,204
"HOOK, 1 HANGER ,MAGIC GARDEN",204
FOLDING BUTTERFLY MIRROR RED  ,204
PARTY INVITES JAZZ HEARTS,204
DOORMAT I LOVE LONDON,204
DINOSAUR PARTY BAG + STICKER SET,204
RED HEART LUGGAGE TAG,202
MAGNETS PACK OF 4 CHILDHOOD MEMORY,202
SET OF 2 TINS JARDIN DE PROVENCE,202
LARGE POPCORN HOLDER ,202
CREAM SLICE FLANNEL PINK SPOT ,202
FAIRY DREAMS INCENSE ,202
CHEST OF DRAWERS GINGHAM HEART ,202
I LOVE LONDON BEAKER,202
SET OF 2 TINS VINTAGE BATHROOM ,202
KITTENS DESIGN FLANNEL,202
HOUSE SHAPE PENCIL SHARPENER,202
WRAP DOLLY GIRL,202
FELT FARM ANIMAL WHITE BUNNY ,200
12 EGG HOUSE PAINTED WOOD,200
FILIGREE HEART DAISY WHITE,200
SET OF 2 ROUND TINS CAMEMBERT ,200
EGG FRYING PAN IVORY ,200
VINTAGE CHRISTMAS PAPER GIFT BAG,200
DOORMAT NEIGHBOURHOOD WITCH ,200
BOYS ALPHABET IRON ON PATCHES,200
EASTER DECORATION HANGING BUNNY,200
COSMETIC BAG VINTAGE ROSE PAISLEY,200
MOBILE VINTAGE HEARTS ,200
BLUE VICTORIAN FABRIC OVAL BOX,200
3 RAFFIA RIBBONS VINTAGE CHRISTMAS,200
VINTAGE UNION JACK DOORSTOP,200
CHRISTMAS MUSICAL ZINC TREE,198
CAKE STAND 3 TIER MAGIC GARDEN,198
LAUREL HEART ANTIQUE SILVER,198
REGENCY CAKE FORK,198
PINK POLKADOT GARDEN PARASOL,198
PACK 6 HEART/ICE-CREAM PATCHES,198
ORIGAMI ROSE INCENSE/CANDLE SET ,198
TROPICAL PASSPORT COVER ,198
QUEEN OF SKIES LUGGAGE TAG,198
VANILLA INCENSE IN TIN,198
PAPER CHAIN KIT LONDON,198
DAISY GARDEN MARKER,196
RED VICTORIAN FABRIC OVAL BOX,196
COCKTAIL SWORDS 50 PIECES,196
4 WILDFLOWER BOTANICAL CANDLES,196
PINK METAL CHICKEN HEART ,196
PINK BUTTERFLY HANDBAG W BOBBLES,196
PAPER CHAIN KIT SKULLS ,196
RED RETROSPOT BIG BOWL,196
BIRTHDAY PARTY CORDON BARRIER TAPE,196
KIDS RAIN MAC PINK,196
GLITTER HEART GARLAND WITH BELLS ,196
FAIRY TALE COTTAGE NIGHTLIGHT,194
BLUE POLKADOT PASSPORT COVER,194
CHINESE DRAGON PAPER LANTERNS,194
TOAST ITS - BEST MUM,194
SANDWICH BATH SPONGE,194
LARGE HANGING IVORY & RED WOOD BIRD,194
LARGE DECO JEWELLERY STAND,194
POCKET BAG PINK PAISELY BROWN SPOT,194
SET OF 2 CERAMIC CHRISTMAS TREES,194
ELEPHANT BIRTHDAY CARD ,194
BOTANICAL GARDENS WALL CLOCK ,192
VINTAGE BEAD PINK EVENING BAG,192
HEARTS GIFT TAPE,192
