index,ItemDescription
CAKE STAND LOVEBIRD 2 TIER WHITE,192
"SWISS ROLL TOWEL, CHOCOLATE  SPOTS",192
TWO DOOR CURIO CABINET,192
PARTY PIZZA DISH RED RETROSPOT,192
FRIDGE MAGNETS LA VIE EN ROSE,190
SET OF 4 PISTACHIO LOVEBIRD COASTER,190
LARGE WHITE HONEYCOMB PAPER BELL  ,190
HEART GARLAND RUSTIC PADDED,190
SET/12 TAPER CANDLES,190
YULETIDE IMAGES GIFT WRAP SET,190
PARTY INVITES DINOSAURS,190
METAL SIGN HER DINNER IS SERVED ,190
ROSE 1 WICK MORRIS BOXED CANDLE,190
BLUE POLKADOT BEAKER ,188
LARGE ROUND WICKER PLATTER ,188
METAL MERRY CHRISTMAS WREATH,188
SMALL WHITE RETROSPOT MUG IN BOX ,188
MULTICOLOUR HONEYCOMB FAN,188
ORIGAMI SANDLEWOOD INCENSE/CAND SET,188
MINI FUNKY DESIGN TAPES,188
WRAP  VINTAGE DOILY ,188
BOOM BOX SPEAKER GIRLS,188
CAKES AND BOWS GIFT  TAPE,186
PLAYING CARDS VINTAGE DOILY ,186
ROSE FOLKART HEART DECORATIONS,186
CHERUB HEART DECORATION SILVER ,186
GROW YOUR OWN HERBS SET OF 3,186
DRAWER KNOB CERAMIC BLACK,186
IVORY ENCHANTED FOREST PLACEMAT,186
BLUE POLKADOT GARDEN PARASOL,186
REGENCY CAKE SLICE,186
BLUE PAISLEY TISSUE BOX,186
HANGING JAM JAR T-LIGHT HOLDERS,186
MINI JIGSAW CIRCUS PARADE ,186
BLUE ROSE FABRIC MIRROR,184
HOT STUFF HOT WATER BOTTLE,184
BLACK CANDELABRA T-LIGHT HOLDER,184
RED  EGG  SPOON,184
ANTIQUE SILVER BAUBLE LAMP  ,184
CARDHOLDER GINGHAM CHRISTMAS TREE,184
YELLOW METAL CHICKEN HEART ,184
36 DOILIES DOLLY GIRL,184
CARD HOLDER LOVE BIRD LARGE ,184
RED RETROSPOT SHOPPING BAG,184
WHITE BELL HONEYCOMB PAPER ,184
CHRISTMAS TREE HANGING SILVER ,184
GARDENIA 3 WICK MORRIS BOXED CANDLE,184
HANGING QUILTED PATCHWORK APPLES,184
SET OF 2 CERAMIC CHRISTMAS REINDEER,184
GLASS JAR MARMALADE ,182
DOORMAT VINTAGE LEAVES DESIGN ,182
ZINC SWEETHEART WIRE LETTER RACK,182
PURPLE PAPER PARASOL,182
BABY BOOM RIBBONS ,182
KIDS RAIN MAC BLUE,182
JOY WOODEN BLOCK LETTERS,182
PINK FAIRY CAKE CUSHION COVER,182
APRON MODERN VINTAGE COTTON,182
FRENCH FLORAL CUSHION COVER ,182
CANDY SPOT EGG WARMER RABBIT,182
DAIRY MAID STRIPE MUG,182
DOG TOY WITH PINK CROCHET SKIRT,182
POLKA DOT RAFFIA FOOD COVER,182
MAGIC DRAWING SLATE BAKE A CAKE ,180
CHARLIE & LOLA WASTEPAPER BIN BLUE,180
MAGIC GARDEN FELT GARLAND ,180
IVORY LOVE BIRD CANDLE,180
FRYING PAN BLUE POLKADOT,180
FIVE CATS HANGING DECORATION,180
WOVEN ROSE GARDEN CUSHION COVER ,180
SEWING BOX RETROSPOT DESIGN ,180
ZINC HEART LATTICE T-LIGHT HOLDER,180
SWEETHEART WIRE FRUIT BOWL,180
3D DOG PICTURE PLAYING CARDS,180
WHITE TRAVEL ALARM CLOCK,180
SET/4 BADGES BALLOON GIRL,180
RETRO PLASTIC POLKA TRAY,180
SET/4 BADGES DOGS,180
CHRISTMAS TREE PAINTED ZINC ,180
CHILDS GARDEN BRUSH PINK,180
WOVEN BERRIES CUSHION COVER ,178
3 GARDENIA MORRIS BOXED CANDLES,178
PASTEL COLOUR HONEYCOMB FAN,178
CANDY SPOT EGG WARMER HARE,178
ORANGE SCENTED SET/9 T-LIGHTS,178
WALL MIRROR RECTANGLE DIAMANTE PINK,178
VINTAGE BILLBOARD TEA MUG,176
HOME SWEET HOME BOTTLE ,176
GLASS JAR KINGS CHOICE,176
OCEAN SCENT CANDLE IN JEWELLED BOX,176
 I LOVE LONDON MINI BACKPACK,176
LOVE HEART SOCK HANGER,176
HEART MINI PORTRAIT FRAME,176
SINGLE WIRE HOOK IVORY HEART,176
HANGING PHOTO CLIP ROPE LADDER,176
TOMATO CHARLIE+LOLA COASTER SET,176
SUMMER DAISIES BAG CHARM,176
MOTHER'S KITCHEN SPOON REST ,176
CHILDS GARDEN SPADE PINK,176
MINI JIGSAW PURDEY,176
SET/6 FROG PRINCE T-LIGHT CANDLES,176
FRIDGE MAGNETS LES ENFANTS ASSORTED,176
VINTAGE RED ENAMEL TRIM PLATE,176
JIGSAW TOADSTOOLS 3 PIECE,176
SMALL POP BOX FUNKY MONKEY,176
SET OF 6 KASHMIR FOLKART BAUBLES,174
EGG FRYING PAN PINK ,174
IVORY REFECTORY CLOCK,174
RED PAPER PARASOL,174
WASH BAG VINTAGE ROSE PAISLEY,174
WALL ART ONLY ONE PERSON ,174
EIGHT PIECE SNAKE  SET,174
MINT GREEN ROSE TOWEL,172
MIDNIGHT GLAMOUR SCARF KNITTING KIT,172
ASSTD MULTICOLOUR CIRCLES MUG,172
SMALL LICORICE DES PINK BOWL,172
CHARLIE+LOLA MY ROOM DOOR SIGN,172
RUSTIC MIRROR WITH LACE HEART,172
BULL DOG BOTTLE TOP WALL CLOCK,172
ORIGAMI LAVENDER INCENSE/CANDL SET ,172
"TRAY, BREAKFAST IN BED",172
ORGANISER WOOD ANTIQUE WHITE ,172
CHILDRENS GARDEN GLOVES BLUE,172
WALL ART KEEP CALM ,172
DECORATION SITTING BUNNY,172
EGG CUP MILKMAID HEIDI,170
EASTER DECORATION EGG BUNNY ,170
SET OF 6 HALLOWEEN GHOST T-LIGHTS,170
MONEY BOX KINGS CHOICE DESIGN,170
HANGING ENGRAVED METAL HEART,170
ASSORTED TUTTI FRUTTI  FOB NOTEBOOK,170
ORIGAMI JASMINE INCENSE/CANDLE SET,170
GROW YOUR OWN FLOWERS SET OF 3,170
WHEELBARROW FOR CHILDREN ,170
DAISIES  HONEYCOMB GARLAND ,170
RED FLOCK LOVE HEART PHOTO FRAME,170
GREY FLORAL FELTCRAFT SHOULDER BAG,168
PARLOUR CERAMIC WALL HOOK,168
RETROSPOT PADDED SEAT CUSHION,168
CERAMIC BOWL WITH LOVE HEART DESIGN,168
LARGE PINK GLASS SUNDAE DISH,168
APRON APPLE DELIGHT,168
CHILDS GARDEN BRUSH BLUE,168
CHARLIE AND LOLA TABLE TINS,168
SET OF 4 FAIRY CAKE PLACEMATS,168
T-LIGHT HOLDER HANGING LACE,168
DOVE DECORATION PAINTED ZINC ,168
12 DAISY PEGS IN WOOD BOX,168
SET OF 4 BLACK LOVEBIRD COASTERS,166
SEASIDE FLYING DISC,166
PIG KEYRING WITH LIGHT & SOUND ,166
ICON MUG REVOLUTIONARY,166
BLUE POLKADOT LUGGAGE TAG ,166
WRAP GINGHAM ROSE ,166
BLUE REFECTORY CLOCK ,166
BLUE PUDDING SPOON,166
KITCHEN FLOWER POTS WALL PLAQUE,166
WHITE GOOSE FEATHER CHRISTMAS TREE ,166
PACK OF 12 VINTAGE LEAF TISSUES ,166
PARTY INVITES FOOTBALL,166
MILK PAN BLUE POLKADOT,164
MEASURING TAPE BABUSHKA BLUE,164
VINTAGE RED TEATIME MUG,164
BLUE PAISLEY JOURNAL ,164
MINI PAINTED GARDEN DECORATION ,164
POMPOM CURTAIN,164
PINK  HONEYCOMB PAPER BALL ,162
EASTER BUNNY GARLAND OF FLOWERS,162
CARDHOLDER GINGHAM STAR,162
BROCANTE SHELF WITH HOOKS,162
PANDA AND BUNNIES STICKER SHEET,162
WHITE WIRE EGG HOLDER,162
BOTANICAL LAVENDER BIRTHDAY CARD,162
PACK 20 ENGLISH ROSE PAPER NAPKINS,162
SET OF 2 ROUND TINS DUTCH CHEESE,162
LE GRAND TRAY CHIC SET,162
LAVENDER TOILETTE BOTTLE,160
PINK  HEART CONFETTI IN TUBE,160
ANTIQUE HEART SHELF UNIT,160
CHRYSANTHEMUM NOTEBOOK,160
SMALL DECO JEWELLERY STAND,160
SKULLS  DESIGN  COTTON TOTE BAG,160
HANGING  BUTTERFLY T-LIGHT HOLDER,160
EASTER DECORATION SITTING BUNNY,160
NATURAL HANGING QUILTED HEARTS ,160
GOLD MUG BONE CHINA TREE OF LIFE,160
MADRAS NOTEBOOK MEDIUM,160
Next Day Carriage,160
BUNNY EGG GARLAND,160
VINTAGE JINGLE BELLS HEART,160
CAKE PLATE LOVEBIRD PINK,158
PARTY CONES CANDY ASSORTED,158
HANGING HEART BONHEUR,158
HANGING FAIRY CAKE DECORATION,158
SET OF 4 POLKADOT COASTERS,158
PINK FLOWER CROCHET FOOD COVER,158
IVORY PILLAR CANDLE SILVER FLOCK,158
GLASS  SONGBIRD STORAGE JAR,158
WRAP GREEN PEARS ,158
FRENCH STYLE STORAGE JAR BONBONS,158
PINK HANGING HEART T-LIGHT HOLDER,158
GIFT BAG BIRTHDAY,158
ZINC HEART FLOWER T-LIGHT HOLDER,158
REGENCY TEA SPOON,158
FELT FARM ANIMAL RABBIT,158
BAKING MOULD EASTER EGG WHITE CHOC,158
PINK SWEETHEART BRACELET,158
CUTE CATS TAPE,158
CHRISTMAS DECOUPAGE CANDLE,158
CHRISTMAS TREE HANGING GOLD,158
EUCALYPTUS & PINECONE  WREATH,158
GREEN 3 PIECE POLKADOT CUTLERY SET,158
SET OF 4 POLKADOT PLACEMATS ,158
HEART MIRROR ANTIQUE WHITE,156
RETRO PLASTIC ELEPHANT TRAY,156
LOVE GARLAND PAINTED ZINC ,156
ABSTRACT CIRCLES SKETCHBOOK ,156
LETS GO SHOPPING COTTON TOTE BAG,156
CLASSIC FRENCH STYLE BASKET GREEN ,156
SET 12 LAVENDER  BOTANICAL T-LIGHTS,156
ANGEL DECORATION PAINTED ZINC ,156
DOLLY MIXTURE CHILDREN'S UMBRELLA,156
FRAPPUCINO SCARF KNITTING KIT,154
EGG FRYING PAN BLUE ,154
MINI JIGSAW BUNNIES,154
BIRDS MOBILE VINTAGE DESIGN,154
JINGLE BELLS TREE DECORATION,154
PACK OF 12 RED APPLE TISSUES,154
3D SHEET OF CAT STICKERS,154
WALL ART 70'S ALPHABET ,154
FELT TOADSTOOL  SMALL,154
SET OF 2 TEA TOWELS PING MICROWAVE,154
FAIRY SOAP SOAP HOLDER,154
ENAMEL PINK COFFEE CONTAINER,154
WHITE BAMBOO RIBS LAMPSHADE,154
TEA PARTY  WRAPPING PAPER ,154
Discount,154
HANGING MINI COLOURED BOTTLES,154
HANGING SPRING FLOWER EGG LARGE,154
PARTY PIZZA DISH PINK POLKADOT,154
QUEEN OF THE SKIES PASSPORT COVER ,152
SET/4 BADGES BEETLES,152
SET OF 6 T-LIGHTS EASTER CHICKS,152
CHOC TRUFFLE GOLD TRINKET POT ,152
BLUE POLKADOT COFFEE MUG,152
PRETTY HANGING QUILTED HEARTS,152
EGG CUP MILKMAID INGRID,152
DRAWER KNOB CERAMIC RED,150
PARTY INVITES SPACEMAN,150
RED RETROSPOT STORAGE JAR,150
CHERRY BLOSSOM DECORATIVE FLASK,150
WHITE TALL PORCELAIN T-LIGHT HOLDER,150
BLUE POLKADOT KIDS BAG,150
MULTICOLOUR HONEYCOMB PAPER GARLAND,150
CLASSIC FRENCH STYLE BASKET BROWN,150
PARTY PIZZA DISH BLUE POLKADOT,150
CHILDRENS GARDEN GLOVES PINK,150
EMBROIDERED RIBBON REEL SALLY ,150
HANGING SPRING FLOWER EGG SMALL,150
WOODLAND STORAGE BOX LARGE ,150
MAGIC DRAWING SLATE LEAP FROG ,150
MULTICOLOUR 3D BALLS GARLAND,150
75 GREEN PETIT FOUR CASES,148
FOLDING UMBRELLA BLACKBLUE POLKADOT,148
SET OF 12 T-LIGHTS VINTAGE DOILY,148
PAPERWEIGHT VINTAGE COLLAGE,148
WHITE HEART CONFETTI IN TUBE,148
RED TEA TOWEL CLASSIC DESIGN,148
PINK ROSE WASHBAG,148
HOME SWEET HOME 2 DRAWER CABINET,148
PARTY FOOD SHOPPER BAG,148
CARD HOLDER LOVE BIRD SMALL,148
SET 3 WICKER STORAGE BASKETS ,148
DOCTOR'S BAG SOFT TOY,148
BAKING MOULD TOFFEE CUP CHOCOLATE,146
"NURSERY A,B,C PAINTED LETTERS",146
ABSTRACT CIRCLE JOURNAL ,146
GINGHAM ROSE WRAP,146
ETCHED GLASS COASTER,146
ENAMEL PINK TEA CONTAINER,146
BLUE FELT EASTER EGG BASKET,146
JAM CLOCK MAGNET,146
CHILDS GARDEN RAKE PINK,146
WHITE HONEYCOMB PAPER GARLAND ,146
MONEY BOX POCKET MONEY DESIGN,146
FRENCH STYLE STORAGE JAR CAFE ,146
SKULLS TAPE,146
BATHROOM METAL SIGN ,146
CHERUB HEART DECORATION GOLD,146
SET/6 EAU DE NIL BIRD T-LIGHTS,144
"WHITE TEA,COFFEE,SUGAR JARS",144
BIRDCAGE DECORATION TEALIGHT HOLDER,144
WRAP COWBOYS  ,144
EMBROIDERED RIBBON REEL DAISY ,144
CHOCOLATE 3 WICK MORRIS BOX CANDLE,144
CABIN BAG VINTAGE RETROSPOT,144
RED PUDDING SPOON,144
ICE CREAM DESIGN GARDEN PARASOL,144
GARDENIA 1 WICK MORRIS BOXED CANDLE,144
LOVE LARGE WOOD LETTERS ,142
EMBROIDERED RIBBON REEL SUSIE ,142
S/12 MINI RABBIT EASTER,142
INFLATABLE POLITICAL GLOBE ,142
16 PIECE CUTLERY SET PANTRY DESIGN,142
EASTER DECORATION NATURAL CHICK,142
WOVEN BUBBLE GUM CUSHION COVER,142
ROSE SCENT CANDLE IN JEWELLED BOX,142
SPACE OWL,142
SET/3 DECOUPAGE STACKING TINS,142
SET/3 CHRISTMAS DECOUPAGE CANDLES,142
PARTY INVITES BALLOON GIRL,142
CHERRY BLOSSOM PASSPORT COVER,142
BLACK ENCHANTED FOREST PLACEMAT,142
MAGIC DRAWING SLATE GO TO THE FAIR ,142
BLUE POT PLANT CANDLE ,142
WHITE HEARTS WIRE PLANT POT HOLDER,142
FOLKART HEART NAPKIN RINGS,140
MIRROR MOSAIC VOTIVE HOLDER,140
MULTICOLOUR RABBIT EGG WARMER,140
SMALL FOLDING SCISSOR(POINTED EDGE),140
ASSTD FRUIT+FLOWERS FRIDGE MAGNETS,140
PINK  HONEYCOMB PAPER FAN,140
ZINC  HEART T-LIGHT HOLDER,140
UNION STRIPE CUSHION COVER ,140
RED DRAGONFLY HELICOPTER,138
LANDMARK FRAME CAMDEN TOWN ,138
POPART WOODEN PENCILS ASST,138
ROSE DU SUD OVEN GLOVE,138
SILVER DIAMANTE PEN IN GIFT BOX,138
EGG FRYING PAN MINT ,138
ASSORTED TUTTI FRUTTI SMALL PURSE,138
PANTRY 3 HOOK ROLLING PIN HANGER,138
TEATIME ROUND PENCIL SHARPENER ,138
WRAP RED VINTAGE DOILY,138
RED RETROSPOT PUDDING BOWL,138
KINGS CHOICE GIANT TUBE MATCHES,138
LOVE HEART NAPKIN BOX ,138
COCKLE SHELL DISH,138
CERAMIC STRAWBERRY TRINKET TRAY,138
WALL ART VILLAGE SHOW ,136
MINI PLAYING CARDS FUN FAIR ,136
DOORSTOP FOOTBALL DESIGN,136
OFFICE MUG WARMER PINK,136
WHITE SAGE INCENSE,136
T-LIGHT HOLDER WHITE LACE,136
SET OF 36 DOILIES SPACEBOY DESIGN ,136
MIXED NUTS LIGHT GREEN BOWL,136
S/4 BLACK MINI ROSE CANDLE IN BOWL,136
SET OF 4 FAIRY CAKE PLACEMATS ,136
SET 4 VALENTINE DECOUPAGE HEART BOX,134
LED TEA LIGHTS,134
DRAWER KNOB VINTAGE GLASS STAR,134
FOLK ART METAL STAR T-LIGHT HOLDER,134
DECORATION WOBBLY RABBIT METAL ,134
SET OF 36 DINOSAUR PAPER DOILIES,134
DOOR HANGER  MUM + DADS ROOM,134
PARTY CONES CANDY DECORATION,134
RETRO PLASTIC 70'S TRAY,132
ORIGAMI VANILLA INCENSE/CANDLE SET ,132
FOLDING UMBRELLA CREAM POLKADOT,132
BUTTERFLY CROCHET FOOD COVER,132
MIRROR CORNICE,132
SAVOY ART DECO CLOCK,132
FRENCH LATTICE CUSHION COVER ,132
FENG SHUI PILLAR CANDLE,132
CHILDS GARDEN RAKE BLUE,132
BLUE FLY SWAT,132
BEADED CRYSTAL HEART PINK SMALL,132
BAKING MOULD ROSE MILK CHOCOLATE,132
BLUE PAISLEY SKETCHBOOK,132
WHITE CHRISTMAS GARLAND STARS TREES,132
GARDEN PATH JOURNAL,132
ROSE DU SUD DRAWSTRING BAG,132
SET OF 16 VINTAGE SKY BLUE CUTLERY,132
SMALL GLASS SUNDAE DISH CLEAR,130
CERAMIC PLATE STRAWBERRY DESIGN,130
HOME SWEET HOME 3 PEG HANGER ,130
EGG CUP MILKMAID HELGA ,130
PACK 3 IRON ON DOG PATCHES,130
BLUE POLKADOT EGG CUP ,130
LARGE CHINESE STYLE SCISSOR,130
GLITTER CHRISTMAS TREE,130
BASKET OF FLOWERS SEWING KIT,130
RED HEARTS LIGHT CHAIN ,130
ZINC BOX SIGN HOME,130
PORCELAIN BUTTERFLY OIL BURNER,130
ECONOMY LUGGAGE TAG,130
PORCELAIN ROSE SMALL,130
DAISY NOTEBOOK ,130
LAUREL STAR ANTIQUE SILVER ,128
WRAP ALPHABET POSTER  ,128
HAIRCLIPS FORTIES FABRIC ASSORTED,128
RETRO PLASTIC DAISY TRAY,128
BROCANTE COAT RACK,128
CHRISTMAS CARD SCREEN PRINT ,128
ASSORTED EASTER GIFT TAGS,128
CANDY HEART HANGING DECORATION,128
CARTOON  PENCIL SHARPENERS,128
COLUMBIAN CANDLE ROUND,128
ASSORTED COLOUR LIZARD SUCTION HOOK,128
EASTER TREE YELLOW BIRDS,128
FOLK FELT HANGING MULTICOL GARLAND,128
S/15 SILVER GLASS BAUBLES IN BAG,128
DANISH ROSE ROUND SEWING BOX,128
GLITTER STAR GARLAND WITH BELLS ,128
WRAP BILLBOARD FONTS DESIGN,128
FRENCH CARRIAGE LANTERN,126
SAMPLES,126
COFFEE SCENT PILLAR CANDLE,126
SET OF PICTURE FRAME  STICKERS,126
RED POLKADOT COFFEE  MUG,126
PANTRY CHOPPING BOARD,126
PING! MICROWAVE PLATE,126
BEADED CRYSTAL HEART PINK LARGE,126
BLUE PAISLEY POCKET BOOK,126
LILAC DIAMANTE PEN IN GIFT BOX,126
EMBROIDERED RIBBON REEL REBECCA ,126
HANGING METAL RABBIT DECORATION,126
"ART LIGHTS,FUNK MONKEY",126
GEORGIAN TRINKET BOX,126
RED/CREAM STRIPE CUSHION COVER ,124
RIDGED GLASS FINGER BOWL,124
DENIM PATCH PURSE PINK BUTTERFLY,124
4 SKY BLUE DINNER CANDLES,124
RABBIT  DESIGN  COTTON TOTE BAG,124
DANISH ROSE DECORATIVE PLATE,124
PHOTO FRAME LINEN AND LACE SMALL,124
COFFEE MUG BLUE PAISLEY DESIGN,124
WRAP FLOWER SHOP  ,124
PINK HORSE SOCK PUPPET,124
BEADED CRYSTAL HEART GREEN LARGE,124
BLUE BIRDHOUSE DECORATION,124
GROW YOUR OWN PLANT IN A CAN ,124
SUNSET CHECK HAMMOCK,124
PINK ROSE FABRIC MIRROR,124
BLACK LOVE BIRD CANDLE,124
ALPHABET HEARTS STICKER SHEET,122
CHRYSANTHEMUM SKETCHBOOK ,122
SKULLS SQUARE TISSUE BOX,122
BLUE PAPER PARASOL ,122
PINK STITCHED WALL CLOCK,122
COLOURED GLASS STAR T-LIGHT HOLDER,122
SOMBRERO ,122
FELT TOADSTOOL LARGE,122
GLASS CLOCHE LARGE,122
PARTY PIZZA DISH GREEN POLKADOT,122
ASSORTED TUTTI FRUTTI MIRROR,122
SILK PURSE BABUSHKA BLUE,122
FLOWERS  STICKERS,122
SWIRLY CIRCULAR RUBBERS IN BAG,120
PEACH KNITTED HEN ,120
GREEN BIRDHOUSE DECORATION,120
SILVER GLITTER FLOWER VOTIVE HOLDER,120
VINTAGE BEAD PINK SCARF ,120
GARDEN PATH SKETCHBOOK,120
GREEN BITTY LIGHT CHAIN,120
BOTANICAL LILY GREETING CARD,120
FOLDING UMBRELLA CHOCOLATE POLKADOT,118
SNOWSTORM PHOTO FRAME FRIDGE MAGNET,118
HAPPY EASTER HANGING DECORATION,118
STORAGE TIN HOME SWEET HOME,118
LOVELY BONBON STICKER SHEET,118
MIRROR MOSAIC CANDLE PLATE,118
SET OF 16 VINTAGE RED CUTLERY,118
CALENDAR FAMILY FAVOURITES,118
ASSORTED MONKEY SUCTION CUP HOOK,118
LANDMARK FRAME OXFORD STREET,118
BOOZE & WOMEN GREETING CARD ,118
WOVEN FROST CUSHION COVER,118
SCOTTIES DESIGN WASHBAG,118
DOILY THANK YOU CARD,118
MONEY BOX BISCUITS DESIGN,116
SET OF 4 NAPKIN CHARMS 3 KEYS ,116
 TRELLIS COAT RACK,116
MEDIUM MEDINA STAMPED METAL BOWL ,116
TUB 24 PINK FLOWER PEGS,116
BLUE GLASS GEMS IN BAG,116
HEART SHAPE WIRELESS DOORBELL,116
EMBROIDERED RIBBON REEL ROSIE,116
NINJA RABBIT BLACK,116
MONEY BOX HOUSEKEEPING DESIGN,116
THREE MINI HANGING FRAMES,116
LANDMARK FRAME COVENT GARDEN ,114
SILVER PLATE CANDLE BOWL SMALL,114
NAMASTE SWAGAT INCENSE,114
200 BENDY SKULL STRAWS,114
ZINC FINISH 15CM PLANTER POTS,114
ROCOCO WALL MIRROR WHITE,114
BLACK AND WHITE DOG BOWL,114
MINI JIGSAW BAKE A CAKE ,114
SET/4 BIRD MIRROR MAGNETS ,114
SCOTTIES CHILDRENS APRON,114
LARGE MEDINA STAMPED METAL BOWL ,112
GLASS CHALICE BLUE SMALL ,112
"LETTER ""A"" BLING KEY RING",112
VINTAGE KEEPSAKE BOX PARIS DAYS,112
SMALL FOLKART STAR CHRISTMAS DEC,112
VINTAGE KEEPSAKE BOX TRAVELOGUE,112
SPACE FROG,112
SET OF 4 KNICK KNACK TINS LEAVES ,112
BLUE  DIAMANTE PEN IN GIFT BOX,112
GREEN ENAMEL+GLASS HAIR COMB,112
GREEN FERN SKETCHBOOK ,112
IVORY HANGING DECORATION  EGG,112
VINTAGE RED MUG,112
FELT FARM ANIMAL CHICKEN,112
GREEN FERN JOURNAL ,112
CANDLE PLATE LACE WHITE,112
PINK HAWAIIAN PICNIC HAMPER FOR 2,110
YELLOW SHARK HELICOPTER,110
SCENTED VELVET LOUNGE CANDLE ,110
SMALL SKULL WINDMILL,110
RETROSPOT BABUSHKA DOORSTOP,110
LOLITA  DESIGN  COTTON TOTE BAG,110
LANDMARK FRAME LONDON BRIDGE ,110
FELT EGG COSY LADYBIRD ,110
CHRISTMAS GINGHAM HEART,110
CAROUSEL DESIGN WASHBAG,110
PINK/PURPLE RETRO RADIO,110
DRAWER KNOB VINTAGE GLASS BALL,110
TEATIME FUNKY FLOWER BACKPACK FOR 2,110
HELLO SAILOR BLUE SOAP HOLDER,108
GREEN CAT FLORAL CUSHION COVER ,108
SMALL CHINESE STYLE SCISSOR,108
CHOCOLATE 1 WICK MORRIS BOX CANDLE,108
MIRRORED WALL ART STARS,108
SQUARE MINI PORTRAIT FRAME,108
TUMBLER NEW ENGLAND,108
SET/4 BADGES CUTE CREATURES,108
PAINTED LIGHTBULB STAR+ MOON,108
LANDMARK FRAME NOTTING HILL ,108
TRAVEL CARD WALLET VINTAGE ROSE ,108
CREAM SLICE FLANNEL CHOCOLATE SPOT ,108
"GREETING CARD, STICKY GORDON",108
"GREETING CARD, OVERCROWDED POOL.",106
BLUE TEA TOWEL CLASSIC DESIGN,106
ROSE DU SUD COSMETICS BAG,106
BAKING MOULD ROSE WHITE CHOCOLATE,106
CAKE STAND LOVEBIRD 2 TIER PINK,106
SET OF 4 NAPKIN CHARMS CROWNS ,106
"BLACK TEA,COFFEE,SUGAR JARS",106
CLOCK MAGNET MUM'S KITCHEN,106
TRIPLE WIRE HOOK IVORY HEART,106
ZINC HEARTS PLANT POT HOLDER,106
CANDY SPOT HAND BAG,106
PHOTO CLIP LINE,106
SET OF 4 NAPKIN CHARMS STARS   ,106
SMALL SQUARE CUT GLASS CANDLESTICK,106
PAPER LANTERN 9 POINT SNOW STAR,106
VINTAGE BEAD NOTEBOOK,104
STAR PORTABLE TABLE LIGHT ,104
WRAP BIRD GARDEN ,104
SMALL HAMMERED SILVER CANDLEPOT ,104
WOODLAND SMALL RED FELT HEART,104
SMALL POLKADOT CHOCOLATE GIFT BAG ,104
SET OF 16 VINTAGE BLACK CUTLERY,104
PINK SCOTTIE DOG W FLOWER PATTERN,104
SILK PURSE BABUSHKA RED,104
COFFEE MUG PINK PAISLEY DESIGN,104
DOORMAT CHRISTMAS VILLAGE,104
BLUE SCOTTIE DOG W FLOWER PATTERN,104
PAINTED LIGHTBULB RAINBOW DESIGN,104
LARGE STRIPES CHOCOLATE GIFT BAG,102
CAMPHOR WOOD PORTOBELLO MUSHROOM,102
WHITE GOOSE FEATHER TREE 60CM ,102
3D HEARTS  HONEYCOMB PAPER GARLAND,102
"DECORATION , WOBBLY RABBIT , METAL ",102
WHITE HANGING BEADS CANDLE HOLDER,102
OVAL  MINI PORTRAIT FRAME,102
PINK LOVE BIRD CANDLE,102
RIBBONS PURSE ,102
ROSE DU SUD WASHBAG ,102
FAUX FUR CHOCOLATE THROW,100
WHITE SOAP RACK WITH 2 BOTTLES,100
EASTER TIN CHICKS IN GARDEN,100
MUM'S KITCHEN CLOCK,100
GIN AND TONIC DIET METAL SIGN,100
CUBIC MUG PINK POLKADOT,100
BEADED CRYSTAL HEART BLUE ON STICK,100
WHITE BELL HONEYCOMB PAPER GARLAND ,100
TEA TIME TEA SET IN GIFT BOX,100
FLYING PIG WATERING CAN,100
FIRST CLASS LUGGAGE TAG ,100
SWEET HEART CAKE CARRIER,100
ANT COPPER LIME BOUDICCA BRACELET,100
WOODLAND STORAGE BOX SMALL,100
EMBOSSED HEART TRINKET BOX,100
CANDY SPOT HEART DECORATION,100
PURPLE SWEETHEART BRACELET,100
CAKES AND RABBITS DESIGN FLANNEL ,100
BLUE KNITTED HEN ,100
FELTCRAFT DOLL MARIA,100
IVORY SWEETHEART SOAP DISH,100
SET OF 4 NAPKIN CHARMS LEAVES   ,100
SWEETIES  STICKERS,100
SET/12 FUNKY FELT FLOWER PEG IN BAG,98
MIRROR MOSAIC HURRICANE LAMP ,98
HYACINTH BULB T-LIGHT CANDLES,98
WRAP MONSTER FUN ,98
ENCHANTED BIRD PLANT CAGE,98
PINK POLKADOT CHILDRENS UMBRELLA,98
IVORY WIRE SWEETHEART LETTER TRAY,98
"CHRISTMAS GARLAND STARS,TREES",98
ENGLISH ROSE SMALL SCENTED FLOWER,98
BLACK AND WHITE CAT BOWL,98
FLOWERS CHANDELIER T-LIGHT HOLDER,98
ASSORTED TUTTI FRUTTI KEYRING BALL,98
EGG CUP HENRIETTA HEN CREAM ,98
N0 SINGING METAL SIGN,98
PINK FLOWER FABRIC PONY,98
BEADED CRYSTAL HEART BLUE  LARGE,96
CHRISTMAS HANGING SNOWFLAKE,96
SMALL MEDINA STAMPED METAL BOWL ,96
MIRRORED WALL ART SNOWFLAKES,96
PAPER BUNTING VINTAGE PARTY,96
BLACK SWEETHEART BRACELET,96
PINK HEARTS LIGHT CHAIN ,96
HOME SWEET HOME HOOK,96
ZINC  STAR T-LIGHT HOLDER ,96
THREE CANVAS LUGGAGE TAGS,96
CLAM SHELL SMALL ,96
ELEPHANT CARNIVAL POUFFE,94
PANTRY HOOK BALLOON WHISK ,94
BLUE DRAGONFLY HELICOPTER,94
?,94
RED APPLES CHOPPING BOARD   ,94
SWEETHEART WALL TIDY ,94
VINTAGE LEAF CHOPPING BOARD  ,94
PSYCHEDELIC TILE HOOK,94
VINTAGE UNION JACK SHOPPING BAG,94
EAU DE NIL LOVE BIRD CANDLE,94
WALL ART HORSE & PONY ,94
MIRRORED WALL ART PHOTO FRAMES,94
CUSHION COVER PINK UNION JACK,94
SET/4 DAISY MIRROR MAGNETS,94
SET OF 3 COLOURED  FLYING DUCKS,94
ANIMAL STICKERS,94
CERAMIC LOVE HEART MONEY BANK,94
BEADED CHANDELIER T-LIGHT HOLDER,94
RIDGED GLASS POSY VASE ,94
SILVER FABRIC MIRROR,92
VINTAGE RED KITCHEN CABINET,92
ADULT APRON APPLE DELIGHT,92
FUNKY MONKEY CUSHION COVER,92
GREEN GOOSE FEATHER TREE 60CM,92
JARDIN ETCHED GLASS FRUITBOWL,92
POPPY FIELDS CHOPPING BOARD,92
DINOSAUR HEIGHT CHART STICKER SET,92
PAPERWEIGHT SAVE THE PLANET,92
HENRIETTA HEN MUG ,92
IVORY CHANDELIER T-LIGHT HOLDER,92
WHITE STITCHED WALL CLOCK,92
ROSE DU SUD CUSHION COVER,92
DECORATION WOBBLY CHICKEN,92
MIRRORED WALL ART SKULLS,92
KEEP OUT BOYS DOOR HANGER ,92
EMBROIDERED RIBBON REEL RACHEL ,92
SILVER JEWELLED MIRROR TRINKET TRAY,90
SHOE SHINE BOX ,90
damages,90
FRUIT SALAD BAG CHARM,90
IVORY CAFE HANGING LAMP ,90
SMALL ZINC HEART WALL ORGANISER,90
PIN CUSHION BABUSHKA RED,90
WIRE EGG BASKET ,90
LAUREL HEART ANTIQUE GOLD,90
RETROSPOT CANDLE  SMALL,90
LETTER SHAPE PENCIL SHARPENER,90
GREEN GOOSE FEATHER CHRISTMAS TREE ,90
LOVE SEAT ANTIQUE WHITE METAL,90
OLD ROSE COMBO BEAD NECKLACE,90
NUMBER TILE COTTAGE GARDEN 1,90
MR ROBOT SOFT TOY,90
FELT FARM ANIMAL HEN,90
GREEN FERN NOTEBOOK,90
SET OF 6 RIBBONS PERFECTLY PRETTY  ,90
FOLDING UMBRELLA PINKWHITE POLKADOT,90
BLACK DINER WALL CLOCK,90
PIN CUSHION BABUSHKA BLUE,90
PHOTO FRAME LINEN AND LACE LARGE,90
ABSTRACT CIRCLES POCKET BOOK,90
MOCK LOBSTER FRIDGE MAGNET,90
EMBROIDERED RIBBON REEL SOPHIE  ,90
VINTAGE ROSE BEAD BRACELET RASPBERR,88
PINK GLASS CANDLEHOLDER,88
SQUARE FLOOR CUSHION VINTAGE RED,88
ROSE SCENT CANDLE JEWELLED DRAWER,88
HANGING CLEAR MINI BOTTLE,88
EDWARDIAN HEART PHOTO FRAME,88
SKULLS STORAGE BOX SMALL,88
GREEN SWEETHEART BRACELET,88
PINK NEW BAROQUECANDLESTICK CANDLE,88
RETROSPOT CANDLE  MEDIUM,88
TREE T-LIGHT HOLDER WILLIE WINKIE,88
ENAMEL BLUE RIM BISCUIT BIN,88
MEASURING TAPE BABUSHKA RED,88
SET/4 COLOURFUL MIXING BOWLS,88
PINK FLY SWAT,88
HEART BEADED TRELLIS DECORATION,88
4 ROSE PINK DINNER CANDLES,88
FELT FARM ANIMAL SHEEP,88
3 TIER SWEETHEART GARDEN SHELF,88
NINJA RABBIT PINK,88
18PC WOODEN CUTLERY SET DISPOSABLE,86
"SWISS ROLL TOWEL, PINK  SPOTS",86
damaged,86
ORANGE TV TRAY TABLE ,86
PINK PADDED MOBILE,86
SUNFLOWER DECORATIVE PARASOL,86
GINGHAM BABUSHKA DOORSTOP,86
NUMBER TILE VINTAGE FONT 3,86
75 GREEN FAIRY CAKE CASES,86
BLUE PATCH PURSE PINK HEART,86
PINK/WHITE CHRISTMAS TREE 60CM,86
MIRRORED WALL ART GENTS,86
GREEN METAL SWINGING BUNNY,86
LARGE CAKE STAND HANGING HEARTS,86
SMALL PINK GLASS SUNDAE DISH,86
WRAP MAGIC FOREST ,86
RIDGED GLASS T-LIGHT HOLDER,86
FIRST CLASS PASSPORT COVER ,86
BLACK STITCHED WALL CLOCK,86
PAIR PADDED HANGERS PINK CHECK,86
JARDIN ETCHED GLASS CHEESE DISH,86
DANISH ROSE DELUXE COASTER,86
CUPID DESIGN SCENTED CANDLES,86
SET OF 6 VINTAGE NOTELETS KIT,84
SMALLFOLKART BAUBLE CHRISTMAS DEC,84
WHITE AND BLUE CERAMIC OIL BURNER,84
TUMBLER BAROQUE,84
SQUARECUSHION COVER PINK UNION JACK,84
SMALL SILVER FLOWER CANDLE POT,84
MULTI HEARTS  STICKERS,84
HEN PARTY CORDON BARRIER TAPE,84
S/12 VANILLA  BOTANICAL T-LIGHTS,84
IVORY WIRE KITCHEN ORGANISER,84
PINK HEART SHAPE PHOTO FRAME,84
SMALL CAMPHOR WOOD FIELD  MUSHROOM,82
MINI JIGSAW GO TO THE FAIR,82
CHRISTMAS CARD SINGING ANGEL,82
"LETTER ""S"" BLING KEY RING",82
MOUSEY LONG LEGS SOFT TOY,82
PINK CHICK EGG WARMER + EGG CUP,82
BLUE & WHITE BREAKFAST TRAY,82
BOX/12 CHICK & EGG IN BASKET,82
SMALL PINK MAGIC CHRISTMAS TREE,82
RAINBOW PEGS PHOTO CLIP STRING,82
STOP FOR TEA WALL ART,82
ANTIQUE GLASS HEART DECORATION ,82
 4 PURPLE FLOCK DINNER CANDLES,82
SILVER RECORD COVER FRAME,82
"LETTER ""J"" BLING KEY RING",82
ASSORTED TUTTI FRUTTI NOTEBOOK,82
NUMBER TILE COTTAGE GARDEN 2,82
PAISLEY PARK CARD,82
CHRYSANTHEMUM  JOURNAL,82
PINK PAISLEY ROSE GIFT WRAP,82
ASS FLORAL PRINT SPIRIT LEVEL ,82
EASTER TIN BUCKET,82
PACK OF 12 CHRISTMAS FUN CARDS,82
FUNKY MONKEY GIFT BAG MEDIUM,82
SET OF 3 PANTRY WOODEN SPOONS,82
FLOWERS TILE COASTER,80
BLUE NEW BAROQUE CANDLESTICK CANDLE,80
SET/6 BLACK BIRD T-LIGHT CANDLES,80
RUSTIC STRAWBERRY JAM POT LARGE ,80
BLUE SCANDINAVIAN PAISLEY WRAP,80
WALL ART CAT AND BIRD ,80
WALL ART LOVES' SECRET ,80
"GREETING CARD, TWO SISTERS.",80
EAU DE NILE HEART SHAPE PHOTO FRAME,80
LAUREL STAR ANTIQUE GOLD,80
COSY SLIPPER SHOES LARGE GREEN,80
BLUE JUICY FRUIT PHOTO FRAME,80
SET/4 BLUE FLOWER CANDLES IN BOWL,78
EGG CUP HENRIETTA HEN PINK,78
PEARLISED IVORY HEART LARGE ,78
WALL ART BUFFALO BILL ,78
CINNAMON SCENTED VOTIVE CANDLE,78
GOLD PHOTO FRAME,78
WOVEN CANDY CUSHION COVER ,78
BLUE TV TRAY TABLE ,78
PAPER LANTERN 9 POINT SNOW STAR ,78
SET OF 4 DIAMOND NAPKIN RINGS,78
DOORSTOP RACING CAR DESIGN,78
BICYCLE SAFTEY WALL ART,78
WRAP WEDDING DAY,78
RECTANGULAR SHAPED MIRROR,78
MILK PAN PINK POLKADOT,78
SWISS ROLL TOWEL PINK  SPOTS,78
EIGHT PIECE DINOSAUR SET,78
DRAGONS BLOOD INCENSE,78
GREEN JUICY FRUIT PHOTO FRAME,78
SUNSET COLOUR CHUNKY KNITTED THROW,78
SILVER M.O.P ORBIT DROP EARRINGS,76
"LETTER ""K"" BLING KEY RING",76
PAIR OF PINK FLOWER CLUSTER SLIDE,76
SNACK TRAY RED VINTAGE DOILY,76
ASSORTED CIRCULAR MOBILE,76
DAISY HAIR BAND,76
WOODLAND SMALL BLUE FELT HEART,76
CORONA MEXICAN TRAY,76
SET OF 6 T-LIGHTS WEDDING CAKE ,76
BANK ACCOUNT  GREETING  CARD ,76
MILK MAIDS MUG ,76
ASSTD DESIGN 3D PAPER STICKERS,76
POLYESTER FILLER PAD 45x30cm,76
SILVER PHOTO FRAME,76
6PC WOOD PLATE SET DISPOSABLE,76
MIRRORED WALL ART POPPIES,76
LARGE ZINC HEART WALL ORGANISER,76
CINAMMON & ORANGE WREATH,76
BLACK CHAMPAGNE GLASS,76
4 PINK DINNER CANDLE SILVER FLOCK,74
CAKE STAND VICTORIAN FILIGREE LARGE,74
SMALL KITCHEN FLOWER POTS PLAQUE,74
GLASS SPHERE CANDLE STAND MEDIUM,74
CABIN BAG VINTAGE PAISLEY,74
"DECORATION , WOBBLY CHICKEN, METAL ",74
"LETTER ""L"" BLING KEY RING",74
WALL ART SPACEBOY,74
GRASS HOPPER WOODEN WALL CLOCK ,74
5 HOOK HANGER MAGIC TOADSTOOL,74
CAMOUFLAGE DESIGN TEDDY,74
Bank Charges,74
SET OF 4 NAPKIN CHARMS INSTRUMENT,74
BLACK BAROQUE WALL CLOCK ,74
